artifact/Figure12/cutlassgemm-benchmark/cutlass-gemm-bench_execution.log



=============================
  Problem ID: 1

        Provider: [1;37mCUTLASS[0m
   OperationKind: [1;37mgemm[0m
       Operation: cutlass_tensorop_h1688gemm_256x128_32x2_nn_align1

          Status: [1;37mSuccess[0m
    Verification: [1;37mON[0m
     Disposition: [1;32mPassed[0m

reference_device: Passed
          cuBLAS: Not run
           cuDNN: Not run

       Arguments: --gemm_kind=universal --m=1 --n=14336 --k=57344 --A=f16:column --B=f16:column --C=f16:column --D=f16:column  \
                  --alpha=1 --beta=0 --split_k_mode=serial --split_k_slices=1 --batch_count=1 --raster_order=heuristic  \
                  --op_class=tensorop --accum=f16 --cta_m=256 --cta_n=128 --cta_k=32 --cluster_m=1 --cluster_n=1 --cluster_k=1  \
                  --stages=2 --warps_m=4 --warps_n=2 --warps_k=1 --inst_m=16 --inst_n=8 --inst_k=8 --min_cc=75 --max_cc=1024  \
                 

           Bytes: 1644310528  bytes
           FLOPs: 1644195840  flops
           FLOPs/Byte: 0

         Runtime: 2.9481  ms
          Memory: 519.448 GiB/s

            Math: 557.714 GFLOP/s



=============================
  Problem ID: 1

        Provider: [1;37mCUTLASS[0m
   OperationKind: [1;37mgemm[0m
       Operation: cutlass_tensorop_h1688gemm_128x256_32x2_nn_align1

          Status: [1;37mSuccess[0m
    Verification: [1;37mON[0m
     Disposition: [1;32mPassed[0m

reference_device: Passed
          cuBLAS: Not run
           cuDNN: Not run

       Arguments: --gemm_kind=universal --m=1 --n=14336 --k=57344 --A=f16:column --B=f16:column --C=f16:column --D=f16:column  \
                  --alpha=1 --beta=0 --split_k_mode=serial --split_k_slices=1 --batch_count=1 --raster_order=heuristic  \
                  --op_class=tensorop --accum=f16 --cta_m=128 --cta_n=256 --cta_k=32 --cluster_m=1 --cluster_n=1 --cluster_k=1  \
                  --stages=2 --warps_m=2 --warps_n=4 --warps_k=1 --inst_m=16 --inst_n=8 --inst_k=8 --min_cc=75 --max_cc=1024  \
                 

           Bytes: 1644310528  bytes
           FLOPs: 1644195840  flops
           FLOPs/Byte: 0

         Runtime: 2.25608  ms
          Memory: 678.782 GiB/s

            Math: 728.785 GFLOP/s



=============================
  Problem ID: 1

        Provider: [1;37mCUTLASS[0m
   OperationKind: [1;37mgemm[0m
       Operation: cutlass_tensorop_h1688gemm_128x128_32x2_nn_align1

          Status: [1;37mSuccess[0m
    Verification: [1;37mON[0m
     Disposition: [1;32mPassed[0m

reference_device: Passed
          cuBLAS: Not run
           cuDNN: Not run

       Arguments: --gemm_kind=universal --m=1 --n=14336 --k=57344 --A=f16:column --B=f16:column --C=f16:column --D=f16:column  \
                  --alpha=1 --beta=0 --split_k_mode=serial --split_k_slices=1 --batch_count=1 --raster_order=heuristic  \
                  --op_class=tensorop --accum=f16 --cta_m=128 --cta_n=128 --cta_k=32 --cluster_m=1 --cluster_n=1 --cluster_k=1  \
                  --stages=2 --warps_m=2 --warps_n=2 --warps_k=1 --inst_m=16 --inst_n=8 --inst_k=8 --min_cc=75 --max_cc=1024  \
                 

           Bytes: 1644310528  bytes
           FLOPs: 1644195840  flops
           FLOPs/Byte: 0

         Runtime: 2.08466  ms
          Memory: 734.597 GiB/s

            Math: 788.712 GFLOP/s



=============================
  Problem ID: 1

        Provider: [1;37mCUTLASS[0m
   OperationKind: [1;37mgemm[0m
       Operation: cutlass_tensorop_h1688gemm_64x256_32x2_nn_align1

          Status: [1;37mSuccess[0m
    Verification: [1;37mON[0m
     Disposition: [1;32mPassed[0m

reference_device: Passed
          cuBLAS: Not run
           cuDNN: Not run

       Arguments: --gemm_kind=universal --m=1 --n=14336 --k=57344 --A=f16:column --B=f16:column --C=f16:column --D=f16:column  \
                  --alpha=1 --beta=0 --split_k_mode=serial --split_k_slices=1 --batch_count=1 --raster_order=heuristic  \
                  --op_class=tensorop --accum=f16 --cta_m=64 --cta_n=256 --cta_k=32 --cluster_m=1 --cluster_n=1 --cluster_k=1  \
                  --stages=2 --warps_m=1 --warps_n=4 --warps_k=1 --inst_m=16 --inst_n=8 --inst_k=8 --min_cc=75 --max_cc=1024  \
                 

           Bytes: 1644310528  bytes
           FLOPs: 1644195840  flops
           FLOPs/Byte: 0

         Runtime: 2.16371  ms
          Memory: 707.758 GiB/s

            Math: 759.896 GFLOP/s



=============================
  Problem ID: 1

        Provider: [1;37mCUTLASS[0m
   OperationKind: [1;37mgemm[0m
       Operation: cutlass_tensorop_h1688gemm_256x64_32x2_nn_align1

          Status: [1;37mSuccess[0m
    Verification: [1;37mON[0m
     Disposition: [1;32mPassed[0m

reference_device: Passed
          cuBLAS: Not run
           cuDNN: Not run

       Arguments: --gemm_kind=universal --m=1 --n=14336 --k=57344 --A=f16:column --B=f16:column --C=f16:column --D=f16:column  \
                  --alpha=1 --beta=0 --split_k_mode=serial --split_k_slices=1 --batch_count=1 --raster_order=heuristic  \
                  --op_class=tensorop --accum=f16 --cta_m=256 --cta_n=64 --cta_k=32 --cluster_m=1 --cluster_n=1 --cluster_k=1  \
                  --stages=2 --warps_m=4 --warps_n=1 --warps_k=1 --inst_m=16 --inst_n=8 --inst_k=8 --min_cc=75 --max_cc=1024  \
                 

           Bytes: 1644310528  bytes
           FLOPs: 1644195840  flops
           FLOPs/Byte: 0

         Runtime: 2.60608  ms
          Memory: 587.62 GiB/s

            Math: 630.908 GFLOP/s



=============================
  Problem ID: 1

        Provider: [1;37mCUTLASS[0m
   OperationKind: [1;37mgemm[0m
       Operation: cutlass_tensorop_h1688gemm_64x128_32x2_nn_align1

          Status: [1;37mSuccess[0m
    Verification: [1;37mON[0m
     Disposition: [1;32mPassed[0m

reference_device: Passed
          cuBLAS: Not run
           cuDNN: Not run

       Arguments: --gemm_kind=universal --m=1 --n=14336 --k=57344 --A=f16:column --B=f16:column --C=f16:column --D=f16:column  \
                  --alpha=1 --beta=0 --split_k_mode=serial --split_k_slices=1 --batch_count=1 --raster_order=heuristic  \
                  --op_class=tensorop --accum=f16 --cta_m=64 --cta_n=128 --cta_k=32 --cluster_m=1 --cluster_n=1 --cluster_k=1  \
                  --stages=2 --warps_m=2 --warps_n=2 --warps_k=1 --inst_m=16 --inst_n=8 --inst_k=8 --min_cc=75 --max_cc=1024  \
                 

           Bytes: 1644310528  bytes
           FLOPs: 1644195840  flops
           FLOPs/Byte: 0

         Runtime: 1.9458  ms
          Memory: 787.018 GiB/s

            Math: 844.995 GFLOP/s



=============================
  Problem ID: 1

        Provider: [1;37mCUTLASS[0m
   OperationKind: [1;37mgemm[0m
       Operation: cutlass_tensorop_h1688gemm_128x64_32x2_nn_align1

          Status: [1;37mSuccess[0m
    Verification: [1;37mON[0m
     Disposition: [1;32mPassed[0m

reference_device: Passed
          cuBLAS: Not run
           cuDNN: Not run

       Arguments: --gemm_kind=universal --m=1 --n=14336 --k=57344 --A=f16:column --B=f16:column --C=f16:column --D=f16:column  \
                  --alpha=1 --beta=0 --split_k_mode=serial --split_k_slices=1 --batch_count=1 --raster_order=heuristic  \
                  --op_class=tensorop --accum=f16 --cta_m=128 --cta_n=64 --cta_k=32 --cluster_m=1 --cluster_n=1 --cluster_k=1  \
                  --stages=2 --warps_m=2 --warps_n=2 --warps_k=1 --inst_m=16 --inst_n=8 --inst_k=8 --min_cc=75 --max_cc=1024  \
                 

           Bytes: 1644310528  bytes
           FLOPs: 1644195840  flops
           FLOPs/Byte: 0

         Runtime: 1.98246  ms
          Memory: 772.465 GiB/s

            Math: 829.37 GFLOP/s



=============================
  Problem ID: 1

        Provider: [1;37mCUTLASS[0m
   OperationKind: [1;37mgemm[0m
       Operation: cutlass_tensorop_h1688gemm_64x64_32x2_nn_align1

          Status: [1;37mSuccess[0m
    Verification: [1;37mON[0m
     Disposition: [1;32mPassed[0m

reference_device: Passed
          cuBLAS: Not run
           cuDNN: Not run

       Arguments: --gemm_kind=universal --m=1 --n=14336 --k=57344 --A=f16:column --B=f16:column --C=f16:column --D=f16:column  \
                  --alpha=1 --beta=0 --split_k_mode=serial --split_k_slices=1 --batch_count=1 --raster_order=heuristic  \
                  --op_class=tensorop --accum=f16 --cta_m=64 --cta_n=64 --cta_k=32 --cluster_m=1 --cluster_n=1 --cluster_k=1  \
                  --stages=2 --warps_m=2 --warps_n=2 --warps_k=1 --inst_m=16 --inst_n=8 --inst_k=8 --min_cc=75 --max_cc=1024  \
                 

           Bytes: 1644310528  bytes
           FLOPs: 1644195840  flops
           FLOPs/Byte: 0

         Runtime: 1.9071  ms
          Memory: 802.992 GiB/s

            Math: 862.146 GFLOP/s



=============================
  Problem ID: 1

        Provider: [1;37mCUTLASS[0m
   OperationKind: [1;37mgemm[0m
       Operation: cutlass_tensorop_h1688gemm_64x128_64x2_nn_align1

          Status: [1;37mSuccess[0m
    Verification: [1;37mON[0m
     Disposition: [1;32mPassed[0m

reference_device: Passed
          cuBLAS: Not run
           cuDNN: Not run

       Arguments: --gemm_kind=universal --m=1 --n=14336 --k=57344 --A=f16:column --B=f16:column --C=f16:column --D=f16:column  \
                  --alpha=1 --beta=0 --split_k_mode=serial --split_k_slices=1 --batch_count=1 --raster_order=heuristic  \
                  --op_class=tensorop --accum=f16 --cta_m=64 --cta_n=128 --cta_k=64 --cluster_m=1 --cluster_n=1 --cluster_k=1  \
                  --stages=2 --warps_m=1 --warps_n=2 --warps_k=2 --inst_m=16 --inst_n=8 --inst_k=8 --min_cc=75 --max_cc=1024  \
                 

           Bytes: 1644310528  bytes
           FLOPs: 1644195840  flops
           FLOPs/Byte: 0

         Runtime: 1.91058  ms
          Memory: 801.528 GiB/s

            Math: 860.575 GFLOP/s



=============================
  Problem ID: 1

        Provider: [1;37mCUTLASS[0m
   OperationKind: [1;37mgemm[0m
       Operation: cutlass_tensorop_h1688gemm_256x128_32x2_nt_align1

          Status: [1;37mSuccess[0m
    Verification: [1;37mON[0m
     Disposition: [1;32mPassed[0m

reference_device: Passed
          cuBLAS: Not run
           cuDNN: Not run

       Arguments: --gemm_kind=universal --m=1 --n=14336 --k=57344 --A=f16:column --B=f16:row --C=f16:column --D=f16:column  \
                  --alpha=1 --beta=0 --split_k_mode=serial --split_k_slices=1 --batch_count=1 --raster_order=heuristic  \
                  --op_class=tensorop --accum=f16 --cta_m=256 --cta_n=128 --cta_k=32 --cluster_m=1 --cluster_n=1 --cluster_k=1  \
                  --stages=2 --warps_m=4 --warps_n=2 --warps_k=1 --inst_m=16 --inst_n=8 --inst_k=8 --min_cc=75 --max_cc=1024  \
                 

           Bytes: 1644310528  bytes
           FLOPs: 1644195840  flops
           FLOPs/Byte: 0

         Runtime: 2.54853  ms
          Memory: 600.889 GiB/s

            Math: 645.154 GFLOP/s



=============================
  Problem ID: 1

        Provider: [1;37mCUTLASS[0m
   OperationKind: [1;37mgemm[0m
       Operation: cutlass_tensorop_h1688gemm_128x256_32x2_nt_align1

          Status: [1;37mSuccess[0m
    Verification: [1;37mON[0m
     Disposition: [1;32mPassed[0m

reference_device: Passed
          cuBLAS: Not run
           cuDNN: Not run

       Arguments: --gemm_kind=universal --m=1 --n=14336 --k=57344 --A=f16:column --B=f16:row --C=f16:column --D=f16:column  \
                  --alpha=1 --beta=0 --split_k_mode=serial --split_k_slices=1 --batch_count=1 --raster_order=heuristic  \
                  --op_class=tensorop --accum=f16 --cta_m=128 --cta_n=256 --cta_k=32 --cluster_m=1 --cluster_n=1 --cluster_k=1  \
                  --stages=2 --warps_m=2 --warps_n=4 --warps_k=1 --inst_m=16 --inst_n=8 --inst_k=8 --min_cc=75 --max_cc=1024  \
                 

           Bytes: 1644310528  bytes
           FLOPs: 1644195840  flops
           FLOPs/Byte: 0

         Runtime: 1.91181  ms
          Memory: 801.013 GiB/s

            Math: 860.021 GFLOP/s



=============================
  Problem ID: 1

        Provider: [1;37mCUTLASS[0m
   OperationKind: [1;37mgemm[0m
       Operation: cutlass_tensorop_h1688gemm_128x128_32x2_nt_align1

          Status: [1;37mSuccess[0m
    Verification: [1;37mON[0m
     Disposition: [1;32mPassed[0m

reference_device: Passed
          cuBLAS: Not run
           cuDNN: Not run

       Arguments: --gemm_kind=universal --m=1 --n=14336 --k=57344 --A=f16:column --B=f16:row --C=f16:column --D=f16:column  \
                  --alpha=1 --beta=0 --split_k_mode=serial --split_k_slices=1 --batch_count=1 --raster_order=heuristic  \
                  --op_class=tensorop --accum=f16 --cta_m=128 --cta_n=128 --cta_k=32 --cluster_m=1 --cluster_n=1 --cluster_k=1  \
                  --stages=2 --warps_m=2 --warps_n=2 --warps_k=1 --inst_m=16 --inst_n=8 --inst_k=8 --min_cc=75 --max_cc=1024  \
                 

           Bytes: 1644310528  bytes
           FLOPs: 1644195840  flops
           FLOPs/Byte: 0

         Runtime: 1.76108  ms
          Memory: 869.573 GiB/s

            Math: 933.632 GFLOP/s



=============================
  Problem ID: 1

        Provider: [1;37mCUTLASS[0m
   OperationKind: [1;37mgemm[0m
       Operation: cutlass_tensorop_h1688gemm_64x256_32x2_nt_align1

          Status: [1;37mSuccess[0m
    Verification: [1;37mON[0m
     Disposition: [1;32mPassed[0m

reference_device: Passed
          cuBLAS: Not run
           cuDNN: Not run

       Arguments: --gemm_kind=universal --m=1 --n=14336 --k=57344 --A=f16:column --B=f16:row --C=f16:column --D=f16:column  \
                  --alpha=1 --beta=0 --split_k_mode=serial --split_k_slices=1 --batch_count=1 --raster_order=heuristic  \
                  --op_class=tensorop --accum=f16 --cta_m=64 --cta_n=256 --cta_k=32 --cluster_m=1 --cluster_n=1 --cluster_k=1  \
                  --stages=2 --warps_m=1 --warps_n=4 --warps_k=1 --inst_m=16 --inst_n=8 --inst_k=8 --min_cc=75 --max_cc=1024  \
                 

           Bytes: 1644310528  bytes
           FLOPs: 1644195840  flops
           FLOPs/Byte: 0

         Runtime: 2.03571  ms
          Memory: 752.259 GiB/s

            Math: 807.676 GFLOP/s



=============================
  Problem ID: 1

        Provider: [1;37mCUTLASS[0m
   OperationKind: [1;37mgemm[0m
       Operation: cutlass_tensorop_h1688gemm_256x64_32x2_nt_align1

          Status: [1;37mSuccess[0m
    Verification: [1;37mON[0m
     Disposition: [1;32mPassed[0m

reference_device: Passed
          cuBLAS: Not run
           cuDNN: Not run

       Arguments: --gemm_kind=universal --m=1 --n=14336 --k=57344 --A=f16:column --B=f16:row --C=f16:column --D=f16:column  \
                  --alpha=1 --beta=0 --split_k_mode=serial --split_k_slices=1 --batch_count=1 --raster_order=heuristic  \
                  --op_class=tensorop --accum=f16 --cta_m=256 --cta_n=64 --cta_k=32 --cluster_m=1 --cluster_n=1 --cluster_k=1  \
                  --stages=2 --warps_m=4 --warps_n=1 --warps_k=1 --inst_m=16 --inst_n=8 --inst_k=8 --min_cc=75 --max_cc=1024  \
                 

           Bytes: 1644310528  bytes
           FLOPs: 1644195840  flops
           FLOPs/Byte: 0

         Runtime: 1.88088  ms
          Memory: 814.183 GiB/s

            Math: 874.162 GFLOP/s



=============================
  Problem ID: 1

        Provider: [1;37mCUTLASS[0m
   OperationKind: [1;37mgemm[0m
       Operation: cutlass_tensorop_h1688gemm_64x128_32x2_nt_align1

          Status: [1;37mSuccess[0m
    Verification: [1;37mON[0m
     Disposition: [1;32mPassed[0m

reference_device: Passed
          cuBLAS: Not run
           cuDNN: Not run

       Arguments: --gemm_kind=universal --m=1 --n=14336 --k=57344 --A=f16:column --B=f16:row --C=f16:column --D=f16:column  \
                  --alpha=1 --beta=0 --split_k_mode=serial --split_k_slices=1 --batch_count=1 --raster_order=heuristic  \
                  --op_class=tensorop --accum=f16 --cta_m=64 --cta_n=128 --cta_k=32 --cluster_m=1 --cluster_n=1 --cluster_k=1  \
                  --stages=2 --warps_m=2 --warps_n=2 --warps_k=1 --inst_m=16 --inst_n=8 --inst_k=8 --min_cc=75 --max_cc=1024  \
                 

           Bytes: 1644310528  bytes
           FLOPs: 1644195840  flops
           FLOPs/Byte: 0

         Runtime: 1.76947  ms
          Memory: 865.447 GiB/s

            Math: 929.201 GFLOP/s



=============================
  Problem ID: 1

        Provider: [1;37mCUTLASS[0m
   OperationKind: [1;37mgemm[0m
       Operation: cutlass_tensorop_h1688gemm_128x64_32x2_nt_align1

          Status: [1;37mSuccess[0m
    Verification: [1;37mON[0m
     Disposition: [1;32mPassed[0m

reference_device: Passed
          cuBLAS: Not run
           cuDNN: Not run

       Arguments: --gemm_kind=universal --m=1 --n=14336 --k=57344 --A=f16:column --B=f16:row --C=f16:column --D=f16:column  \
                  --alpha=1 --beta=0 --split_k_mode=serial --split_k_slices=1 --batch_count=1 --raster_order=heuristic  \
                  --op_class=tensorop --accum=f16 --cta_m=128 --cta_n=64 --cta_k=32 --cluster_m=1 --cluster_n=1 --cluster_k=1  \
                  --stages=2 --warps_m=2 --warps_n=2 --warps_k=1 --inst_m=16 --inst_n=8 --inst_k=8 --min_cc=75 --max_cc=1024  \
                 

           Bytes: 1644310528  bytes
           FLOPs: 1644195840  flops
           FLOPs/Byte: 0

         Runtime: 1.74551  ms
          Memory: 877.327 GiB/s

            Math: 941.957 GFLOP/s



=============================
  Problem ID: 1

        Provider: [1;37mCUTLASS[0m
   OperationKind: [1;37mgemm[0m
       Operation: cutlass_tensorop_h1688gemm_64x64_32x2_nt_align1

          Status: [1;37mSuccess[0m
    Verification: [1;37mON[0m
     Disposition: [1;32mPassed[0m

reference_device: Passed
          cuBLAS: Not run
           cuDNN: Not run

       Arguments: --gemm_kind=universal --m=1 --n=14336 --k=57344 --A=f16:column --B=f16:row --C=f16:column --D=f16:column  \
                  --alpha=1 --beta=0 --split_k_mode=serial --split_k_slices=1 --batch_count=1 --raster_order=heuristic  \
                  --op_class=tensorop --accum=f16 --cta_m=64 --cta_n=64 --cta_k=32 --cluster_m=1 --cluster_n=1 --cluster_k=1  \
                  --stages=2 --warps_m=2 --warps_n=2 --warps_k=1 --inst_m=16 --inst_n=8 --inst_k=8 --min_cc=75 --max_cc=1024  \
                 

           Bytes: 1644310528  bytes
           FLOPs: 1644195840  flops
           FLOPs/Byte: 0

         Runtime: 1.75329  ms
          Memory: 873.433 GiB/s

            Math: 937.776 GFLOP/s



=============================
  Problem ID: 1

        Provider: [1;37mCUTLASS[0m
   OperationKind: [1;37mgemm[0m
       Operation: cutlass_tensorop_h1688gemm_64x128_64x2_nt_align1

          Status: [1;37mSuccess[0m
    Verification: [1;37mON[0m
     Disposition: [1;32mPassed[0m

reference_device: Passed
          cuBLAS: Not run
           cuDNN: Not run

       Arguments: --gemm_kind=universal --m=1 --n=14336 --k=57344 --A=f16:column --B=f16:row --C=f16:column --D=f16:column  \
                  --alpha=1 --beta=0 --split_k_mode=serial --split_k_slices=1 --batch_count=1 --raster_order=heuristic  \
                  --op_class=tensorop --accum=f16 --cta_m=64 --cta_n=128 --cta_k=64 --cluster_m=1 --cluster_n=1 --cluster_k=1  \
                  --stages=2 --warps_m=1 --warps_n=2 --warps_k=2 --inst_m=16 --inst_n=8 --inst_k=8 --min_cc=75 --max_cc=1024  \
                 

           Bytes: 1644310528  bytes
           FLOPs: 1644195840  flops
           FLOPs/Byte: 0

         Runtime: 1.7367  ms
          Memory: 881.776 GiB/s

            Math: 946.733 GFLOP/s



=============================
  Problem ID: 1

        Provider: [1;37mCUTLASS[0m
   OperationKind: [1;37mgemm[0m
       Operation: cutlass_tensorop_h1688gemm_256x128_32x2_tn_align1

          Status: [1;37mSuccess[0m
    Verification: [1;37mON[0m
     Disposition: [1;32mPassed[0m

reference_device: Passed
          cuBLAS: Not run
           cuDNN: Not run

       Arguments: --gemm_kind=universal --m=1 --n=14336 --k=57344 --A=f16:row --B=f16:column --C=f16:column --D=f16:column  \
                  --alpha=1 --beta=0 --split_k_mode=serial --split_k_slices=1 --batch_count=1 --raster_order=heuristic  \
                  --op_class=tensorop --accum=f16 --cta_m=256 --cta_n=128 --cta_k=32 --cluster_m=1 --cluster_n=1 --cluster_k=1  \
                  --stages=2 --warps_m=4 --warps_n=2 --warps_k=1 --inst_m=16 --inst_n=8 --inst_k=8 --min_cc=75 --max_cc=1024  \
                 

           Bytes: 1644310528  bytes
           FLOPs: 1644195840  flops
           FLOPs/Byte: 0

         Runtime: 2.73961  ms
          Memory: 558.979 GiB/s

            Math: 600.157 GFLOP/s



=============================
  Problem ID: 1

        Provider: [1;37mCUTLASS[0m
   OperationKind: [1;37mgemm[0m
       Operation: cutlass_tensorop_h1688gemm_128x256_32x2_tn_align1

          Status: [1;37mSuccess[0m
    Verification: [1;37mON[0m
     Disposition: [1;32mPassed[0m

reference_device: Passed
          cuBLAS: Not run
           cuDNN: Not run

       Arguments: --gemm_kind=universal --m=1 --n=14336 --k=57344 --A=f16:row --B=f16:column --C=f16:column --D=f16:column  \
                  --alpha=1 --beta=0 --split_k_mode=serial --split_k_slices=1 --batch_count=1 --raster_order=heuristic  \
                  --op_class=tensorop --accum=f16 --cta_m=128 --cta_n=256 --cta_k=32 --cluster_m=1 --cluster_n=1 --cluster_k=1  \
                  --stages=2 --warps_m=2 --warps_n=4 --warps_k=1 --inst_m=16 --inst_n=8 --inst_k=8 --min_cc=75 --max_cc=1024  \
                 

           Bytes: 1644310528  bytes
           FLOPs: 1644195840  flops
           FLOPs/Byte: 0

         Runtime: 2.22228  ms
          Memory: 689.103 GiB/s

            Math: 739.867 GFLOP/s



=============================
  Problem ID: 1

        Provider: [1;37mCUTLASS[0m
   OperationKind: [1;37mgemm[0m
       Operation: cutlass_tensorop_h1688gemm_128x128_32x2_tn_align1

          Status: [1;37mSuccess[0m
    Verification: [1;37mON[0m
     Disposition: [1;32mPassed[0m

reference_device: Passed
          cuBLAS: Not run
           cuDNN: Not run

       Arguments: --gemm_kind=universal --m=1 --n=14336 --k=57344 --A=f16:row --B=f16:column --C=f16:column --D=f16:column  \
                  --alpha=1 --beta=0 --split_k_mode=serial --split_k_slices=1 --batch_count=1 --raster_order=heuristic  \
                  --op_class=tensorop --accum=f16 --cta_m=128 --cta_n=128 --cta_k=32 --cluster_m=1 --cluster_n=1 --cluster_k=1  \
                  --stages=2 --warps_m=2 --warps_n=2 --warps_k=1 --inst_m=16 --inst_n=8 --inst_k=8 --min_cc=75 --max_cc=1024  \
                 

           Bytes: 1644310528  bytes
           FLOPs: 1644195840  flops
           FLOPs/Byte: 0

         Runtime: 2.03182  ms
          Memory: 753.7 GiB/s

            Math: 809.223 GFLOP/s



=============================
  Problem ID: 1

        Provider: [1;37mCUTLASS[0m
   OperationKind: [1;37mgemm[0m
       Operation: cutlass_tensorop_h1688gemm_64x256_32x2_tn_align1

          Status: [1;37mSuccess[0m
    Verification: [1;37mON[0m
     Disposition: [1;32mPassed[0m

reference_device: Passed
          cuBLAS: Not run
           cuDNN: Not run

       Arguments: --gemm_kind=universal --m=1 --n=14336 --k=57344 --A=f16:row --B=f16:column --C=f16:column --D=f16:column  \
                  --alpha=1 --beta=0 --split_k_mode=serial --split_k_slices=1 --batch_count=1 --raster_order=heuristic  \
                  --op_class=tensorop --accum=f16 --cta_m=64 --cta_n=256 --cta_k=32 --cluster_m=1 --cluster_n=1 --cluster_k=1  \
                  --stages=2 --warps_m=1 --warps_n=4 --warps_k=1 --inst_m=16 --inst_n=8 --inst_k=8 --min_cc=75 --max_cc=1024  \
                 

           Bytes: 1644310528  bytes
           FLOPs: 1644195840  flops
           FLOPs/Byte: 0

         Runtime: 2.56041  ms
          Memory: 598.101 GiB/s

            Math: 642.161 GFLOP/s



=============================
  Problem ID: 1

        Provider: [1;37mCUTLASS[0m
   OperationKind: [1;37mgemm[0m
       Operation: cutlass_tensorop_h1688gemm_256x64_32x2_tn_align1

          Status: [1;37mSuccess[0m
    Verification: [1;37mON[0m
     Disposition: [1;32mPassed[0m

reference_device: Passed
          cuBLAS: Not run
           cuDNN: Not run

       Arguments: --gemm_kind=universal --m=1 --n=14336 --k=57344 --A=f16:row --B=f16:column --C=f16:column --D=f16:column  \
                  --alpha=1 --beta=0 --split_k_mode=serial --split_k_slices=1 --batch_count=1 --raster_order=heuristic  \
                  --op_class=tensorop --accum=f16 --cta_m=256 --cta_n=64 --cta_k=32 --cluster_m=1 --cluster_n=1 --cluster_k=1  \
                  --stages=2 --warps_m=4 --warps_n=1 --warps_k=1 --inst_m=16 --inst_n=8 --inst_k=8 --min_cc=75 --max_cc=1024  \
                 

           Bytes: 1644310528  bytes
           FLOPs: 1644195840  flops
           FLOPs/Byte: 0

         Runtime: 2.50552  ms
          Memory: 611.203 GiB/s

            Math: 656.229 GFLOP/s



=============================
  Problem ID: 1

        Provider: [1;37mCUTLASS[0m
   OperationKind: [1;37mgemm[0m
       Operation: cutlass_tensorop_h1688gemm_64x128_32x2_tn_align1

          Status: [1;37mSuccess[0m
    Verification: [1;37mON[0m
     Disposition: [1;32mPassed[0m

reference_device: Passed
          cuBLAS: Not run
           cuDNN: Not run

       Arguments: --gemm_kind=universal --m=1 --n=14336 --k=57344 --A=f16:row --B=f16:column --C=f16:column --D=f16:column  \
                  --alpha=1 --beta=0 --split_k_mode=serial --split_k_slices=1 --batch_count=1 --raster_order=heuristic  \
                  --op_class=tensorop --accum=f16 --cta_m=64 --cta_n=128 --cta_k=32 --cluster_m=1 --cluster_n=1 --cluster_k=1  \
                  --stages=2 --warps_m=2 --warps_n=2 --warps_k=1 --inst_m=16 --inst_n=8 --inst_k=8 --min_cc=75 --max_cc=1024  \
                 

           Bytes: 1644310528  bytes
           FLOPs: 1644195840  flops
           FLOPs/Byte: 0

         Runtime: 2.18419  ms
          Memory: 701.121 GiB/s

            Math: 752.771 GFLOP/s



=============================
  Problem ID: 1

        Provider: [1;37mCUTLASS[0m
   OperationKind: [1;37mgemm[0m
       Operation: cutlass_tensorop_h1688gemm_128x64_32x2_tn_align1

          Status: [1;37mSuccess[0m
    Verification: [1;37mON[0m
     Disposition: [1;32mPassed[0m

reference_device: Passed
          cuBLAS: Not run
           cuDNN: Not run

       Arguments: --gemm_kind=universal --m=1 --n=14336 --k=57344 --A=f16:row --B=f16:column --C=f16:column --D=f16:column  \
                  --alpha=1 --beta=0 --split_k_mode=serial --split_k_slices=1 --batch_count=1 --raster_order=heuristic  \
                  --op_class=tensorop --accum=f16 --cta_m=128 --cta_n=64 --cta_k=32 --cluster_m=1 --cluster_n=1 --cluster_k=1  \
                  --stages=2 --warps_m=2 --warps_n=2 --warps_k=1 --inst_m=16 --inst_n=8 --inst_k=8 --min_cc=75 --max_cc=1024  \
                 

           Bytes: 1644310528  bytes
           FLOPs: 1644195840  flops
           FLOPs/Byte: 0

         Runtime: 1.971  ms
          Memory: 776.96 GiB/s

            Math: 834.196 GFLOP/s



=============================
  Problem ID: 1

        Provider: [1;37mCUTLASS[0m
   OperationKind: [1;37mgemm[0m
       Operation: cutlass_tensorop_h1688gemm_64x64_32x2_tn_align1

          Status: [1;37mSuccess[0m
    Verification: [1;37mON[0m
     Disposition: [1;32mPassed[0m

reference_device: Passed
          cuBLAS: Not run
           cuDNN: Not run

       Arguments: --gemm_kind=universal --m=1 --n=14336 --k=57344 --A=f16:row --B=f16:column --C=f16:column --D=f16:column  \
                  --alpha=1 --beta=0 --split_k_mode=serial --split_k_slices=1 --batch_count=1 --raster_order=heuristic  \
                  --op_class=tensorop --accum=f16 --cta_m=64 --cta_n=64 --cta_k=32 --cluster_m=1 --cluster_n=1 --cluster_k=1  \
                  --stages=2 --warps_m=2 --warps_n=2 --warps_k=1 --inst_m=16 --inst_n=8 --inst_k=8 --min_cc=75 --max_cc=1024  \
                 

           Bytes: 1644310528  bytes
           FLOPs: 1644195840  flops
           FLOPs/Byte: 0

         Runtime: 1.90546  ms
          Memory: 803.682 GiB/s

            Math: 862.887 GFLOP/s



=============================
  Problem ID: 1

        Provider: [1;37mCUTLASS[0m
   OperationKind: [1;37mgemm[0m
       Operation: cutlass_tensorop_h1688gemm_64x128_64x2_tn_align1

          Status: [1;37mSuccess[0m
    Verification: [1;37mON[0m
     Disposition: [1;32mPassed[0m

reference_device: Passed
          cuBLAS: Not run
           cuDNN: Not run

       Arguments: --gemm_kind=universal --m=1 --n=14336 --k=57344 --A=f16:row --B=f16:column --C=f16:column --D=f16:column  \
                  --alpha=1 --beta=0 --split_k_mode=serial --split_k_slices=1 --batch_count=1 --raster_order=heuristic  \
                  --op_class=tensorop --accum=f16 --cta_m=64 --cta_n=128 --cta_k=64 --cluster_m=1 --cluster_n=1 --cluster_k=1  \
                  --stages=2 --warps_m=1 --warps_n=2 --warps_k=2 --inst_m=16 --inst_n=8 --inst_k=8 --min_cc=75 --max_cc=1024  \
                 

           Bytes: 1644310528  bytes
           FLOPs: 1644195840  flops
           FLOPs/Byte: 0

         Runtime: 1.91181  ms
          Memory: 801.013 GiB/s

            Math: 860.021 GFLOP/s



=============================
  Problem ID: 1

        Provider: [1;37mCUTLASS[0m
   OperationKind: [1;37mgemm[0m
       Operation: cutlass_tensorop_h1688gemm_256x128_32x2_tt_align1

          Status: [1;37mSuccess[0m
    Verification: [1;37mON[0m
     Disposition: [1;32mPassed[0m

reference_device: Passed
          cuBLAS: Not run
           cuDNN: Not run

       Arguments: --gemm_kind=universal --m=1 --n=14336 --k=57344 --A=f16:row --B=f16:row --C=f16:column --D=f16:column  \
                  --alpha=1 --beta=0 --split_k_mode=serial --split_k_slices=1 --batch_count=1 --raster_order=heuristic  \
                  --op_class=tensorop --accum=f16 --cta_m=256 --cta_n=128 --cta_k=32 --cluster_m=1 --cluster_n=1 --cluster_k=1  \
                  --stages=2 --warps_m=4 --warps_n=2 --warps_k=1 --inst_m=16 --inst_n=8 --inst_k=8 --min_cc=75 --max_cc=1024  \
                 

           Bytes: 1644310528  bytes
           FLOPs: 1644195840  flops
           FLOPs/Byte: 0

         Runtime: 2.11558  ms
          Memory: 723.859 GiB/s

            Math: 777.183 GFLOP/s



=============================
  Problem ID: 1

        Provider: [1;37mCUTLASS[0m
   OperationKind: [1;37mgemm[0m
       Operation: cutlass_tensorop_h1688gemm_128x256_32x2_tt_align1

          Status: [1;37mSuccess[0m
    Verification: [1;37mON[0m
     Disposition: [1;32mPassed[0m

reference_device: Passed
          cuBLAS: Not run
           cuDNN: Not run

       Arguments: --gemm_kind=universal --m=1 --n=14336 --k=57344 --A=f16:row --B=f16:row --C=f16:column --D=f16:column  \
                  --alpha=1 --beta=0 --split_k_mode=serial --split_k_slices=1 --batch_count=1 --raster_order=heuristic  \
                  --op_class=tensorop --accum=f16 --cta_m=128 --cta_n=256 --cta_k=32 --cluster_m=1 --cluster_n=1 --cluster_k=1  \
                  --stages=2 --warps_m=2 --warps_n=4 --warps_k=1 --inst_m=16 --inst_n=8 --inst_k=8 --min_cc=75 --max_cc=1024  \
                 

           Bytes: 1644310528  bytes
           FLOPs: 1644195840  flops
           FLOPs/Byte: 0

         Runtime: 2.15938  ms
          Memory: 709.178 GiB/s

            Math: 761.421 GFLOP/s



=============================
  Problem ID: 1

        Provider: [1;37mCUTLASS[0m
   OperationKind: [1;37mgemm[0m
       Operation: cutlass_tensorop_h1688gemm_128x128_32x2_tt_align1

          Status: [1;37mSuccess[0m
    Verification: [1;37mON[0m
     Disposition: [1;32mPassed[0m

reference_device: Passed
          cuBLAS: Not run
           cuDNN: Not run

       Arguments: --gemm_kind=universal --m=1 --n=14336 --k=57344 --A=f16:row --B=f16:row --C=f16:column --D=f16:column  \
                  --alpha=1 --beta=0 --split_k_mode=serial --split_k_slices=1 --batch_count=1 --raster_order=heuristic  \
                  --op_class=tensorop --accum=f16 --cta_m=128 --cta_n=128 --cta_k=32 --cluster_m=1 --cluster_n=1 --cluster_k=1  \
                  --stages=2 --warps_m=2 --warps_n=2 --warps_k=1 --inst_m=16 --inst_n=8 --inst_k=8 --min_cc=75 --max_cc=1024  \
                 

           Bytes: 1644310528  bytes
           FLOPs: 1644195840  flops
           FLOPs/Byte: 0

         Runtime: 1.8686  ms
          Memory: 819.537 GiB/s

            Math: 879.91 GFLOP/s



=============================
  Problem ID: 1

        Provider: [1;37mCUTLASS[0m
   OperationKind: [1;37mgemm[0m
       Operation: cutlass_tensorop_h1688gemm_64x256_32x2_tt_align1

          Status: [1;37mSuccess[0m
    Verification: [1;37mON[0m
     Disposition: [1;32mPassed[0m

reference_device: Passed
          cuBLAS: Not run
           cuDNN: Not run

       Arguments: --gemm_kind=universal --m=1 --n=14336 --k=57344 --A=f16:row --B=f16:row --C=f16:column --D=f16:column  \
                  --alpha=1 --beta=0 --split_k_mode=serial --split_k_slices=1 --batch_count=1 --raster_order=heuristic  \
                  --op_class=tensorop --accum=f16 --cta_m=64 --cta_n=256 --cta_k=32 --cluster_m=1 --cluster_n=1 --cluster_k=1  \
                  --stages=2 --warps_m=1 --warps_n=4 --warps_k=1 --inst_m=16 --inst_n=8 --inst_k=8 --min_cc=75 --max_cc=1024  \
                 

           Bytes: 1644310528  bytes
           FLOPs: 1644195840  flops
           FLOPs/Byte: 0

         Runtime: 2.22392  ms
          Memory: 688.596 GiB/s

            Math: 739.322 GFLOP/s



=============================
  Problem ID: 1

        Provider: [1;37mCUTLASS[0m
   OperationKind: [1;37mgemm[0m
       Operation: cutlass_tensorop_h1688gemm_256x64_32x2_tt_align1

          Status: [1;37mSuccess[0m
    Verification: [1;37mON[0m
     Disposition: [1;32mPassed[0m

reference_device: Passed
          cuBLAS: Not run
           cuDNN: Not run

       Arguments: --gemm_kind=universal --m=1 --n=14336 --k=57344 --A=f16:row --B=f16:row --C=f16:column --D=f16:column  \
                  --alpha=1 --beta=0 --split_k_mode=serial --split_k_slices=1 --batch_count=1 --raster_order=heuristic  \
                  --op_class=tensorop --accum=f16 --cta_m=256 --cta_n=64 --cta_k=32 --cluster_m=1 --cluster_n=1 --cluster_k=1  \
                  --stages=2 --warps_m=4 --warps_n=1 --warps_k=1 --inst_m=16 --inst_n=8 --inst_k=8 --min_cc=75 --max_cc=1024  \
                 

           Bytes: 1644310528  bytes
           FLOPs: 1644195840  flops
           FLOPs/Byte: 0

         Runtime: 1.87965  ms
          Memory: 814.716 GiB/s

            Math: 874.733 GFLOP/s



=============================
  Problem ID: 1

        Provider: [1;37mCUTLASS[0m
   OperationKind: [1;37mgemm[0m
       Operation: cutlass_tensorop_h1688gemm_64x128_32x2_tt_align1

          Status: [1;37mSuccess[0m
    Verification: [1;37mON[0m
     Disposition: [1;32mPassed[0m

reference_device: Passed
          cuBLAS: Not run
           cuDNN: Not run

       Arguments: --gemm_kind=universal --m=1 --n=14336 --k=57344 --A=f16:row --B=f16:row --C=f16:column --D=f16:column  \
                  --alpha=1 --beta=0 --split_k_mode=serial --split_k_slices=1 --batch_count=1 --raster_order=heuristic  \
                  --op_class=tensorop --accum=f16 --cta_m=64 --cta_n=128 --cta_k=32 --cluster_m=1 --cluster_n=1 --cluster_k=1  \
                  --stages=2 --warps_m=2 --warps_n=2 --warps_k=1 --inst_m=16 --inst_n=8 --inst_k=8 --min_cc=75 --max_cc=1024  \
                 

           Bytes: 1644310528  bytes
           FLOPs: 1644195840  flops
           FLOPs/Byte: 0

         Runtime: 1.81108  ms
          Memory: 845.564 GiB/s

            Math: 907.855 GFLOP/s



=============================
  Problem ID: 1

        Provider: [1;37mCUTLASS[0m
   OperationKind: [1;37mgemm[0m
       Operation: cutlass_tensorop_h1688gemm_128x64_32x2_tt_align1

          Status: [1;37mSuccess[0m
    Verification: [1;37mON[0m
     Disposition: [1;32mPassed[0m

reference_device: Passed
          cuBLAS: Not run
           cuDNN: Not run

       Arguments: --gemm_kind=universal --m=1 --n=14336 --k=57344 --A=f16:row --B=f16:row --C=f16:column --D=f16:column  \
                  --alpha=1 --beta=0 --split_k_mode=serial --split_k_slices=1 --batch_count=1 --raster_order=heuristic  \
                  --op_class=tensorop --accum=f16 --cta_m=128 --cta_n=64 --cta_k=32 --cluster_m=1 --cluster_n=1 --cluster_k=1  \
                  --stages=2 --warps_m=2 --warps_n=2 --warps_k=1 --inst_m=16 --inst_n=8 --inst_k=8 --min_cc=75 --max_cc=1024  \
                 

           Bytes: 1644310528  bytes
           FLOPs: 1644195840  flops
           FLOPs/Byte: 0

         Runtime: 1.7451  ms
          Memory: 877.533 GiB/s

            Math: 942.178 GFLOP/s



=============================
  Problem ID: 1

        Provider: [1;37mCUTLASS[0m
   OperationKind: [1;37mgemm[0m
       Operation: cutlass_tensorop_h1688gemm_64x64_32x2_tt_align1

          Status: [1;37mSuccess[0m
    Verification: [1;37mON[0m
     Disposition: [1;32mPassed[0m

reference_device: Passed
          cuBLAS: Not run
           cuDNN: Not run

       Arguments: --gemm_kind=universal --m=1 --n=14336 --k=57344 --A=f16:row --B=f16:row --C=f16:column --D=f16:column  \
                  --alpha=1 --beta=0 --split_k_mode=serial --split_k_slices=1 --batch_count=1 --raster_order=heuristic  \
                  --op_class=tensorop --accum=f16 --cta_m=64 --cta_n=64 --cta_k=32 --cluster_m=1 --cluster_n=1 --cluster_k=1  \
                  --stages=2 --warps_m=2 --warps_n=2 --warps_k=1 --inst_m=16 --inst_n=8 --inst_k=8 --min_cc=75 --max_cc=1024  \
                 

           Bytes: 1644310528  bytes
           FLOPs: 1644195840  flops
           FLOPs/Byte: 0

         Runtime: 1.74776  ms
          Memory: 876.196 GiB/s

            Math: 940.743 GFLOP/s



=============================
  Problem ID: 1

        Provider: [1;37mCUTLASS[0m
   OperationKind: [1;37mgemm[0m
       Operation: cutlass_tensorop_h1688gemm_64x128_64x2_tt_align1

          Status: [1;37mSuccess[0m
    Verification: [1;37mON[0m
     Disposition: [1;32mPassed[0m

reference_device: Passed
          cuBLAS: Not run
           cuDNN: Not run

       Arguments: --gemm_kind=universal --m=1 --n=14336 --k=57344 --A=f16:row --B=f16:row --C=f16:column --D=f16:column  \
                  --alpha=1 --beta=0 --split_k_mode=serial --split_k_slices=1 --batch_count=1 --raster_order=heuristic  \
                  --op_class=tensorop --accum=f16 --cta_m=64 --cta_n=128 --cta_k=64 --cluster_m=1 --cluster_n=1 --cluster_k=1  \
                  --stages=2 --warps_m=1 --warps_n=2 --warps_k=2 --inst_m=16 --inst_n=8 --inst_k=8 --min_cc=75 --max_cc=1024  \
                 

           Bytes: 1644310528  bytes
           FLOPs: 1644195840  flops
           FLOPs/Byte: 0

         Runtime: 1.72524  ms
          Memory: 887.638 GiB/s

            Math: 953.027 GFLOP/s

Wrote results to './csv_logs/cutlass_shape_1_57344_14336_performance.gemm.csv'



=============================
  Problem ID: 1

        Provider: [1;37mCUTLASS[0m
   OperationKind: [1;37mgemm[0m
       Operation: cutlass_tensorop_h1688gemm_256x128_32x2_nn_align8

          Status: [1;37mSuccess[0m
    Verification: [1;37mON[0m
     Disposition: [1;32mPassed[0m

reference_device: Passed
          cuBLAS: Not run
           cuDNN: Not run

       Arguments: --gemm_kind=universal --m=32 --n=14336 --k=57344 --A=f16:column --B=f16:column --C=f16:column --D=f16:column  \
                  --alpha=1 --beta=0 --split_k_mode=serial --split_k_slices=1 --batch_count=1 --raster_order=heuristic  \
                  --op_class=tensorop --accum=f16 --cta_m=256 --cta_n=128 --cta_k=32 --cluster_m=1 --cluster_n=1 --cluster_k=1  \
                  --stages=2 --warps_m=4 --warps_n=2 --warps_k=1 --inst_m=16 --inst_n=8 --inst_k=8 --min_cc=75 --max_cc=1024  \
                 

           Bytes: 1648754688  bytes
           FLOPs: 52614266880  flops
           FLOPs/Byte: 31

         Runtime: 2.176  ms
          Memory: 705.663 GiB/s

            Math: 24179.4 GFLOP/s



=============================
  Problem ID: 1

        Provider: [1;37mCUTLASS[0m
   OperationKind: [1;37mgemm[0m
       Operation: cutlass_tensorop_h1688gemm_256x128_32x2_nn_align4

          Status: [1;37mSuccess[0m
    Verification: [1;37mON[0m
     Disposition: [1;32mPassed[0m

reference_device: Passed
          cuBLAS: Not run
           cuDNN: Not run

       Arguments: --gemm_kind=universal --m=32 --n=14336 --k=57344 --A=f16:column --B=f16:column --C=f16:column --D=f16:column  \
                  --alpha=1 --beta=0 --split_k_mode=serial --split_k_slices=1 --batch_count=1 --raster_order=heuristic  \
                  --op_class=tensorop --accum=f16 --cta_m=256 --cta_n=128 --cta_k=32 --cluster_m=1 --cluster_n=1 --cluster_k=1  \
                  --stages=2 --warps_m=4 --warps_n=2 --warps_k=1 --inst_m=16 --inst_n=8 --inst_k=8 --min_cc=75 --max_cc=1024  \
                 

           Bytes: 1648754688  bytes
           FLOPs: 52614266880  flops
           FLOPs/Byte: 31

         Runtime: 2.50327  ms
          Memory: 613.407 GiB/s

            Math: 21018.2 GFLOP/s



=============================
  Problem ID: 1

        Provider: [1;37mCUTLASS[0m
   OperationKind: [1;37mgemm[0m
       Operation: cutlass_tensorop_h1688gemm_256x128_32x2_nn_align2

          Status: [1;37mSuccess[0m
    Verification: [1;37mON[0m
     Disposition: [1;32mPassed[0m

reference_device: Passed
          cuBLAS: Not run
           cuDNN: Not run

       Arguments: --gemm_kind=universal --m=32 --n=14336 --k=57344 --A=f16:column --B=f16:column --C=f16:column --D=f16:column  \
                  --alpha=1 --beta=0 --split_k_mode=serial --split_k_slices=1 --batch_count=1 --raster_order=heuristic  \
                  --op_class=tensorop --accum=f16 --cta_m=256 --cta_n=128 --cta_k=32 --cluster_m=1 --cluster_n=1 --cluster_k=1  \
                  --stages=2 --warps_m=4 --warps_n=2 --warps_k=1 --inst_m=16 --inst_n=8 --inst_k=8 --min_cc=75 --max_cc=1024  \
                 

           Bytes: 1648754688  bytes
           FLOPs: 52614266880  flops
           FLOPs/Byte: 31

         Runtime: 2.52539  ms
          Memory: 608.034 GiB/s

            Math: 20834.1 GFLOP/s



=============================
  Problem ID: 1

        Provider: [1;37mCUTLASS[0m
   OperationKind: [1;37mgemm[0m
       Operation: cutlass_tensorop_h1688gemm_256x128_32x2_nn_align1

          Status: [1;37mSuccess[0m
    Verification: [1;37mON[0m
     Disposition: [1;32mPassed[0m

reference_device: Passed
          cuBLAS: Not run
           cuDNN: Not run

       Arguments: --gemm_kind=universal --m=32 --n=14336 --k=57344 --A=f16:column --B=f16:column --C=f16:column --D=f16:column  \
                  --alpha=1 --beta=0 --split_k_mode=serial --split_k_slices=1 --batch_count=1 --raster_order=heuristic  \
                  --op_class=tensorop --accum=f16 --cta_m=256 --cta_n=128 --cta_k=32 --cluster_m=1 --cluster_n=1 --cluster_k=1  \
                  --stages=2 --warps_m=4 --warps_n=2 --warps_k=1 --inst_m=16 --inst_n=8 --inst_k=8 --min_cc=75 --max_cc=1024  \
                 

           Bytes: 1648754688  bytes
           FLOPs: 52614266880  flops
           FLOPs/Byte: 31

         Runtime: 2.75927  ms
          Memory: 556.496 GiB/s

            Math: 19068.2 GFLOP/s



=============================
  Problem ID: 1

        Provider: [1;37mCUTLASS[0m
   OperationKind: [1;37mgemm[0m
       Operation: cutlass_tensorop_h1688gemm_128x256_32x2_nn_align8

          Status: [1;37mSuccess[0m
    Verification: [1;37mON[0m
     Disposition: [1;32mPassed[0m

reference_device: Passed
          cuBLAS: Not run
           cuDNN: Not run

       Arguments: --gemm_kind=universal --m=32 --n=14336 --k=57344 --A=f16:column --B=f16:column --C=f16:column --D=f16:column  \
                  --alpha=1 --beta=0 --split_k_mode=serial --split_k_slices=1 --batch_count=1 --raster_order=heuristic  \
                  --op_class=tensorop --accum=f16 --cta_m=128 --cta_n=256 --cta_k=32 --cluster_m=1 --cluster_n=1 --cluster_k=1  \
                  --stages=2 --warps_m=2 --warps_n=4 --warps_k=1 --inst_m=16 --inst_n=8 --inst_k=8 --min_cc=75 --max_cc=1024  \
                 

           Bytes: 1648754688  bytes
           FLOPs: 52614266880  flops
           FLOPs/Byte: 31

         Runtime: 2.09244  ms
          Memory: 733.842 GiB/s

            Math: 25144.9 GFLOP/s



=============================
  Problem ID: 1

        Provider: [1;37mCUTLASS[0m
   OperationKind: [1;37mgemm[0m
       Operation: cutlass_tensorop_h1688gemm_128x256_32x2_nn_align4

          Status: [1;37mSuccess[0m
    Verification: [1;37mON[0m
     Disposition: [1;32mPassed[0m

reference_device: Passed
          cuBLAS: Not run
           cuDNN: Not run

       Arguments: --gemm_kind=universal --m=32 --n=14336 --k=57344 --A=f16:column --B=f16:column --C=f16:column --D=f16:column  \
                  --alpha=1 --beta=0 --split_k_mode=serial --split_k_slices=1 --batch_count=1 --raster_order=heuristic  \
                  --op_class=tensorop --accum=f16 --cta_m=128 --cta_n=256 --cta_k=32 --cluster_m=1 --cluster_n=1 --cluster_k=1  \
                  --stages=2 --warps_m=2 --warps_n=4 --warps_k=1 --inst_m=16 --inst_n=8 --inst_k=8 --min_cc=75 --max_cc=1024  \
                 

           Bytes: 1648754688  bytes
           FLOPs: 52614266880  flops
           FLOPs/Byte: 31

         Runtime: 2.13299  ms
          Memory: 719.891 GiB/s

            Math: 24666.9 GFLOP/s



=============================
  Problem ID: 1

        Provider: [1;37mCUTLASS[0m
   OperationKind: [1;37mgemm[0m
       Operation: cutlass_tensorop_h1688gemm_128x256_32x2_nn_align2

          Status: [1;37mSuccess[0m
    Verification: [1;37mON[0m
     Disposition: [1;32mPassed[0m

reference_device: Passed
          cuBLAS: Not run
           cuDNN: Not run

       Arguments: --gemm_kind=universal --m=32 --n=14336 --k=57344 --A=f16:column --B=f16:column --C=f16:column --D=f16:column  \
                  --alpha=1 --beta=0 --split_k_mode=serial --split_k_slices=1 --batch_count=1 --raster_order=heuristic  \
                  --op_class=tensorop --accum=f16 --cta_m=128 --cta_n=256 --cta_k=32 --cluster_m=1 --cluster_n=1 --cluster_k=1  \
                  --stages=2 --warps_m=2 --warps_n=4 --warps_k=1 --inst_m=16 --inst_n=8 --inst_k=8 --min_cc=75 --max_cc=1024  \
                 

           Bytes: 1648754688  bytes
           FLOPs: 52614266880  flops
           FLOPs/Byte: 31

         Runtime: 2.10802  ms
          Memory: 728.42 GiB/s

            Math: 24959.1 GFLOP/s



=============================
  Problem ID: 1

        Provider: [1;37mCUTLASS[0m
   OperationKind: [1;37mgemm[0m
       Operation: cutlass_tensorop_h1688gemm_128x256_32x2_nn_align1

          Status: [1;37mSuccess[0m
    Verification: [1;37mON[0m
     Disposition: [1;32mPassed[0m

reference_device: Passed
          cuBLAS: Not run
           cuDNN: Not run

       Arguments: --gemm_kind=universal --m=32 --n=14336 --k=57344 --A=f16:column --B=f16:column --C=f16:column --D=f16:column  \
                  --alpha=1 --beta=0 --split_k_mode=serial --split_k_slices=1 --batch_count=1 --raster_order=heuristic  \
                  --op_class=tensorop --accum=f16 --cta_m=128 --cta_n=256 --cta_k=32 --cluster_m=1 --cluster_n=1 --cluster_k=1  \
                  --stages=2 --warps_m=2 --warps_n=4 --warps_k=1 --inst_m=16 --inst_n=8 --inst_k=8 --min_cc=75 --max_cc=1024  \
                 

           Bytes: 1648754688  bytes
           FLOPs: 52614266880  flops
           FLOPs/Byte: 31

         Runtime: 2.16433  ms
          Memory: 709.469 GiB/s

            Math: 24309.8 GFLOP/s



=============================
  Problem ID: 1

        Provider: [1;37mCUTLASS[0m
   OperationKind: [1;37mgemm[0m
       Operation: cutlass_tensorop_h1688gemm_128x128_32x2_nn_align8

          Status: [1;37mSuccess[0m
    Verification: [1;37mON[0m
     Disposition: [1;32mPassed[0m

reference_device: Passed
          cuBLAS: Not run
           cuDNN: Not run

       Arguments: --gemm_kind=universal --m=32 --n=14336 --k=57344 --A=f16:column --B=f16:column --C=f16:column --D=f16:column  \
                  --alpha=1 --beta=0 --split_k_mode=serial --split_k_slices=1 --batch_count=1 --raster_order=heuristic  \
                  --op_class=tensorop --accum=f16 --cta_m=128 --cta_n=128 --cta_k=32 --cluster_m=1 --cluster_n=1 --cluster_k=1  \
                  --stages=2 --warps_m=2 --warps_n=2 --warps_k=1 --inst_m=16 --inst_n=8 --inst_k=8 --min_cc=75 --max_cc=1024  \
                 

           Bytes: 1648754688  bytes
           FLOPs: 52614266880  flops
           FLOPs/Byte: 31

         Runtime: 2.43098  ms
          Memory: 631.649 GiB/s

            Math: 21643.3 GFLOP/s



=============================
  Problem ID: 1

        Provider: [1;37mCUTLASS[0m
   OperationKind: [1;37mgemm[0m
       Operation: cutlass_tensorop_h1688gemm_128x128_32x2_nn_align4

          Status: [1;37mSuccess[0m
    Verification: [1;37mON[0m
     Disposition: [1;32mPassed[0m

reference_device: Passed
          cuBLAS: Not run
           cuDNN: Not run

       Arguments: --gemm_kind=universal --m=32 --n=14336 --k=57344 --A=f16:column --B=f16:column --C=f16:column --D=f16:column  \
                  --alpha=1 --beta=0 --split_k_mode=serial --split_k_slices=1 --batch_count=1 --raster_order=heuristic  \
                  --op_class=tensorop --accum=f16 --cta_m=128 --cta_n=128 --cta_k=32 --cluster_m=1 --cluster_n=1 --cluster_k=1  \
                  --stages=2 --warps_m=2 --warps_n=2 --warps_k=1 --inst_m=16 --inst_n=8 --inst_k=8 --min_cc=75 --max_cc=1024  \
                 

           Bytes: 1648754688  bytes
           FLOPs: 52614266880  flops
           FLOPs/Byte: 31

         Runtime: 2.01851  ms
          Memory: 760.721 GiB/s

            Math: 26065.9 GFLOP/s



=============================
  Problem ID: 1

        Provider: [1;37mCUTLASS[0m
   OperationKind: [1;37mgemm[0m
       Operation: cutlass_tensorop_h1688gemm_128x128_32x2_nn_align2

          Status: [1;37mSuccess[0m
    Verification: [1;37mON[0m
     Disposition: [1;32mPassed[0m

reference_device: Passed
          cuBLAS: Not run
           cuDNN: Not run

       Arguments: --gemm_kind=universal --m=32 --n=14336 --k=57344 --A=f16:column --B=f16:column --C=f16:column --D=f16:column  \
                  --alpha=1 --beta=0 --split_k_mode=serial --split_k_slices=1 --batch_count=1 --raster_order=heuristic  \
                  --op_class=tensorop --accum=f16 --cta_m=128 --cta_n=128 --cta_k=32 --cluster_m=1 --cluster_n=1 --cluster_k=1  \
                  --stages=2 --warps_m=2 --warps_n=2 --warps_k=1 --inst_m=16 --inst_n=8 --inst_k=8 --min_cc=75 --max_cc=1024  \
                 

           Bytes: 1648754688  bytes
           FLOPs: 52614266880  flops
           FLOPs/Byte: 31

         Runtime: 2.05172  ms
          Memory: 748.406 GiB/s

            Math: 25643.9 GFLOP/s



=============================
  Problem ID: 1

        Provider: [1;37mCUTLASS[0m
   OperationKind: [1;37mgemm[0m
       Operation: cutlass_tensorop_h1688gemm_128x128_32x2_nn_align1

          Status: [1;37mSuccess[0m
    Verification: [1;37mON[0m
     Disposition: [1;32mPassed[0m

reference_device: Passed
          cuBLAS: Not run
           cuDNN: Not run

       Arguments: --gemm_kind=universal --m=32 --n=14336 --k=57344 --A=f16:column --B=f16:column --C=f16:column --D=f16:column  \
                  --alpha=1 --beta=0 --split_k_mode=serial --split_k_slices=1 --batch_count=1 --raster_order=heuristic  \
                  --op_class=tensorop --accum=f16 --cta_m=128 --cta_n=128 --cta_k=32 --cluster_m=1 --cluster_n=1 --cluster_k=1  \
                  --stages=2 --warps_m=2 --warps_n=2 --warps_k=1 --inst_m=16 --inst_n=8 --inst_k=8 --min_cc=75 --max_cc=1024  \
                 

           Bytes: 1648754688  bytes
           FLOPs: 52614266880  flops
           FLOPs/Byte: 31

         Runtime: 2.39411  ms
          Memory: 641.375 GiB/s

            Math: 21976.5 GFLOP/s



=============================
  Problem ID: 1

        Provider: [1;37mCUTLASS[0m
   OperationKind: [1;37mgemm[0m
       Operation: cutlass_tensorop_h1688gemm_64x256_32x2_nn_align8

          Status: [1;37mSuccess[0m
    Verification: [1;37mON[0m
     Disposition: [1;32mPassed[0m

reference_device: Passed
          cuBLAS: Not run
           cuDNN: Not run

       Arguments: --gemm_kind=universal --m=32 --n=14336 --k=57344 --A=f16:column --B=f16:column --C=f16:column --D=f16:column  \
                  --alpha=1 --beta=0 --split_k_mode=serial --split_k_slices=1 --batch_count=1 --raster_order=heuristic  \
                  --op_class=tensorop --accum=f16 --cta_m=64 --cta_n=256 --cta_k=32 --cluster_m=1 --cluster_n=1 --cluster_k=1  \
                  --stages=2 --warps_m=1 --warps_n=4 --warps_k=1 --inst_m=16 --inst_n=8 --inst_k=8 --min_cc=75 --max_cc=1024  \
                 

           Bytes: 1648754688  bytes
           FLOPs: 52614266880  flops
           FLOPs/Byte: 31

         Runtime: 2.07034  ms
          Memory: 741.676 GiB/s

            Math: 25413.3 GFLOP/s



=============================
  Problem ID: 1

        Provider: [1;37mCUTLASS[0m
   OperationKind: [1;37mgemm[0m
       Operation: cutlass_tensorop_h1688gemm_64x256_32x2_nn_align4

          Status: [1;37mSuccess[0m
    Verification: [1;37mON[0m
     Disposition: [1;32mPassed[0m

reference_device: Passed
          cuBLAS: Not run
           cuDNN: Not run

       Arguments: --gemm_kind=universal --m=32 --n=14336 --k=57344 --A=f16:column --B=f16:column --C=f16:column --D=f16:column  \
                  --alpha=1 --beta=0 --split_k_mode=serial --split_k_slices=1 --batch_count=1 --raster_order=heuristic  \
                  --op_class=tensorop --accum=f16 --cta_m=64 --cta_n=256 --cta_k=32 --cluster_m=1 --cluster_n=1 --cluster_k=1  \
                  --stages=2 --warps_m=1 --warps_n=4 --warps_k=1 --inst_m=16 --inst_n=8 --inst_k=8 --min_cc=75 --max_cc=1024  \
                 

           Bytes: 1648754688  bytes
           FLOPs: 52614266880  flops
           FLOPs/Byte: 31

         Runtime: 2.09428  ms
          Memory: 733.197 GiB/s

            Math: 25122.8 GFLOP/s



=============================
  Problem ID: 1

        Provider: [1;37mCUTLASS[0m
   OperationKind: [1;37mgemm[0m
       Operation: cutlass_tensorop_h1688gemm_64x256_32x2_nn_align2

          Status: [1;37mSuccess[0m
    Verification: [1;37mON[0m
     Disposition: [1;32mPassed[0m

reference_device: Passed
          cuBLAS: Not run
           cuDNN: Not run

       Arguments: --gemm_kind=universal --m=32 --n=14336 --k=57344 --A=f16:column --B=f16:column --C=f16:column --D=f16:column  \
                  --alpha=1 --beta=0 --split_k_mode=serial --split_k_slices=1 --batch_count=1 --raster_order=heuristic  \
                  --op_class=tensorop --accum=f16 --cta_m=64 --cta_n=256 --cta_k=32 --cluster_m=1 --cluster_n=1 --cluster_k=1  \
                  --stages=2 --warps_m=1 --warps_n=4 --warps_k=1 --inst_m=16 --inst_n=8 --inst_k=8 --min_cc=75 --max_cc=1024  \
                 

           Bytes: 1648754688  bytes
           FLOPs: 52614266880  flops
           FLOPs/Byte: 31

         Runtime: 2.2485  ms
          Memory: 682.91 GiB/s

            Math: 23399.7 GFLOP/s



=============================
  Problem ID: 1

        Provider: [1;37mCUTLASS[0m
   OperationKind: [1;37mgemm[0m
       Operation: cutlass_tensorop_h1688gemm_64x256_32x2_nn_align1

          Status: [1;37mSuccess[0m
    Verification: [1;37mON[0m
     Disposition: [1;32mPassed[0m

reference_device: Passed
          cuBLAS: Not run
           cuDNN: Not run

       Arguments: --gemm_kind=universal --m=32 --n=14336 --k=57344 --A=f16:column --B=f16:column --C=f16:column --D=f16:column  \
                  --alpha=1 --beta=0 --split_k_mode=serial --split_k_slices=1 --batch_count=1 --raster_order=heuristic  \
                  --op_class=tensorop --accum=f16 --cta_m=64 --cta_n=256 --cta_k=32 --cluster_m=1 --cluster_n=1 --cluster_k=1  \
                  --stages=2 --warps_m=1 --warps_n=4 --warps_k=1 --inst_m=16 --inst_n=8 --inst_k=8 --min_cc=75 --max_cc=1024  \
                 

           Bytes: 1648754688  bytes
           FLOPs: 52614266880  flops
           FLOPs/Byte: 31

         Runtime: 2.20201  ms
          Memory: 697.328 GiB/s

            Math: 23893.8 GFLOP/s



=============================
  Problem ID: 1

        Provider: [1;37mCUTLASS[0m
   OperationKind: [1;37mgemm[0m
       Operation: cutlass_tensorop_h1688gemm_256x64_32x2_nn_align8

          Status: [1;37mSuccess[0m
    Verification: [1;37mON[0m
     Disposition: [1;32mPassed[0m

reference_device: Passed
          cuBLAS: Not run
           cuDNN: Not run

       Arguments: --gemm_kind=universal --m=32 --n=14336 --k=57344 --A=f16:column --B=f16:column --C=f16:column --D=f16:column  \
                  --alpha=1 --beta=0 --split_k_mode=serial --split_k_slices=1 --batch_count=1 --raster_order=heuristic  \
                  --op_class=tensorop --accum=f16 --cta_m=256 --cta_n=64 --cta_k=32 --cluster_m=1 --cluster_n=1 --cluster_k=1  \
                  --stages=2 --warps_m=4 --warps_n=1 --warps_k=1 --inst_m=16 --inst_n=8 --inst_k=8 --min_cc=75 --max_cc=1024  \
                 

           Bytes: 1648754688  bytes
           FLOPs: 52614266880  flops
           FLOPs/Byte: 31

         Runtime: 2.27758  ms
          Memory: 674.19 GiB/s

            Math: 23100.9 GFLOP/s



=============================
  Problem ID: 1

        Provider: [1;37mCUTLASS[0m
   OperationKind: [1;37mgemm[0m
       Operation: cutlass_tensorop_h1688gemm_256x64_32x2_nn_align4

          Status: [1;37mSuccess[0m
    Verification: [1;37mON[0m
     Disposition: [1;32mPassed[0m

reference_device: Passed
          cuBLAS: Not run
           cuDNN: Not run

       Arguments: --gemm_kind=universal --m=32 --n=14336 --k=57344 --A=f16:column --B=f16:column --C=f16:column --D=f16:column  \
                  --alpha=1 --beta=0 --split_k_mode=serial --split_k_slices=1 --batch_count=1 --raster_order=heuristic  \
                  --op_class=tensorop --accum=f16 --cta_m=256 --cta_n=64 --cta_k=32 --cluster_m=1 --cluster_n=1 --cluster_k=1  \
                  --stages=2 --warps_m=4 --warps_n=1 --warps_k=1 --inst_m=16 --inst_n=8 --inst_k=8 --min_cc=75 --max_cc=1024  \
                 

           Bytes: 1648754688  bytes
           FLOPs: 52614266880  flops
           FLOPs/Byte: 31

         Runtime: 2.2534  ms
          Memory: 681.426 GiB/s

            Math: 23348.9 GFLOP/s



=============================
  Problem ID: 1

        Provider: [1;37mCUTLASS[0m
   OperationKind: [1;37mgemm[0m
       Operation: cutlass_tensorop_h1688gemm_256x64_32x2_nn_align2

          Status: [1;37mSuccess[0m
    Verification: [1;37mON[0m
     Disposition: [1;32mPassed[0m

reference_device: Passed
          cuBLAS: Not run
           cuDNN: Not run

       Arguments: --gemm_kind=universal --m=32 --n=14336 --k=57344 --A=f16:column --B=f16:column --C=f16:column --D=f16:column  \
                  --alpha=1 --beta=0 --split_k_mode=serial --split_k_slices=1 --batch_count=1 --raster_order=heuristic  \
                  --op_class=tensorop --accum=f16 --cta_m=256 --cta_n=64 --cta_k=32 --cluster_m=1 --cluster_n=1 --cluster_k=1  \
                  --stages=2 --warps_m=4 --warps_n=1 --warps_k=1 --inst_m=16 --inst_n=8 --inst_k=8 --min_cc=75 --max_cc=1024  \
                 

           Bytes: 1648754688  bytes
           FLOPs: 52614266880  flops
           FLOPs/Byte: 31

         Runtime: 2.28413  ms
          Memory: 672.256 GiB/s

            Math: 23034.7 GFLOP/s



=============================
  Problem ID: 1

        Provider: [1;37mCUTLASS[0m
   OperationKind: [1;37mgemm[0m
       Operation: cutlass_tensorop_h1688gemm_256x64_32x2_nn_align1

          Status: [1;37mSuccess[0m
    Verification: [1;37mON[0m
     Disposition: [1;32mPassed[0m

reference_device: Passed
          cuBLAS: Not run
           cuDNN: Not run

       Arguments: --gemm_kind=universal --m=32 --n=14336 --k=57344 --A=f16:column --B=f16:column --C=f16:column --D=f16:column  \
                  --alpha=1 --beta=0 --split_k_mode=serial --split_k_slices=1 --batch_count=1 --raster_order=heuristic  \
                  --op_class=tensorop --accum=f16 --cta_m=256 --cta_n=64 --cta_k=32 --cluster_m=1 --cluster_n=1 --cluster_k=1  \
                  --stages=2 --warps_m=4 --warps_n=1 --warps_k=1 --inst_m=16 --inst_n=8 --inst_k=8 --min_cc=75 --max_cc=1024  \
                 

           Bytes: 1648754688  bytes
           FLOPs: 52614266880  flops
           FLOPs/Byte: 31

         Runtime: 2.72445  ms
          Memory: 563.607 GiB/s

            Math: 19311.9 GFLOP/s



=============================
  Problem ID: 1

        Provider: [1;37mCUTLASS[0m
   OperationKind: [1;37mgemm[0m
       Operation: cutlass_tensorop_h1688gemm_64x128_32x2_nn_align8

          Status: [1;37mSuccess[0m
    Verification: [1;37mON[0m
     Disposition: [1;32mPassed[0m

reference_device: Passed
          cuBLAS: Not run
           cuDNN: Not run

       Arguments: --gemm_kind=universal --m=32 --n=14336 --k=57344 --A=f16:column --B=f16:column --C=f16:column --D=f16:column  \
                  --alpha=1 --beta=0 --split_k_mode=serial --split_k_slices=1 --batch_count=1 --raster_order=heuristic  \
                  --op_class=tensorop --accum=f16 --cta_m=64 --cta_n=128 --cta_k=32 --cluster_m=1 --cluster_n=1 --cluster_k=1  \
                  --stages=2 --warps_m=2 --warps_n=2 --warps_k=1 --inst_m=16 --inst_n=8 --inst_k=8 --min_cc=75 --max_cc=1024  \
                 

           Bytes: 1648754688  bytes
           FLOPs: 52614266880  flops
           FLOPs/Byte: 31

         Runtime: 2.34639  ms
          Memory: 654.418 GiB/s

            Math: 22423.5 GFLOP/s



=============================
  Problem ID: 1

        Provider: [1;37mCUTLASS[0m
   OperationKind: [1;37mgemm[0m
       Operation: cutlass_tensorop_h1688gemm_64x128_32x2_nn_align4

          Status: [1;37mSuccess[0m
    Verification: [1;37mON[0m
     Disposition: [1;32mPassed[0m

reference_device: Passed
          cuBLAS: Not run
           cuDNN: Not run

       Arguments: --gemm_kind=universal --m=32 --n=14336 --k=57344 --A=f16:column --B=f16:column --C=f16:column --D=f16:column  \
                  --alpha=1 --beta=0 --split_k_mode=serial --split_k_slices=1 --batch_count=1 --raster_order=heuristic  \
                  --op_class=tensorop --accum=f16 --cta_m=64 --cta_n=128 --cta_k=32 --cluster_m=1 --cluster_n=1 --cluster_k=1  \
                  --stages=2 --warps_m=2 --warps_n=2 --warps_k=1 --inst_m=16 --inst_n=8 --inst_k=8 --min_cc=75 --max_cc=1024  \
                 

           Bytes: 1648754688  bytes
           FLOPs: 52614266880  flops
           FLOPs/Byte: 31

         Runtime: 2.35559  ms
          Memory: 651.863 GiB/s

            Math: 22335.9 GFLOP/s



=============================
  Problem ID: 1

        Provider: [1;37mCUTLASS[0m
   OperationKind: [1;37mgemm[0m
       Operation: cutlass_tensorop_h1688gemm_64x128_32x2_nn_align2

          Status: [1;37mSuccess[0m
    Verification: [1;37mON[0m
     Disposition: [1;32mPassed[0m

reference_device: Passed
          cuBLAS: Not run
           cuDNN: Not run

