artifact/Figure12/cutlassgemm-benchmark/cutlass-gemm-bench_execution.log



=============================
  Problem ID: 1

        Provider: [1;37mCUTLASS[0m
   OperationKind: [1;37mgemm[0m
       Operation: cutlass_tensorop_h1688gemm_256x128_32x2_nn_align8

          Status: [1;37mSuccess[0m
    Verification: [1;37mON[0m
     Disposition: [1;31mIncorrect[0m

reference_device: Incorrect
          cuBLAS: Not run
           cuDNN: Not run

       Arguments: --gemm_kind=universal --m=8192 --n=8192 --k=28672 --A=f16:column --B=f16:column --C=f16:column --D=f16:column  \
                  --alpha=1 --beta=0 --split_k_mode=serial --split_k_slices=1 --batch_count=1 --raster_order=heuristic  \
                  --op_class=tensorop --accum=f16 --cta_m=256 --cta_n=128 --cta_k=32 --cluster_m=1 --cluster_n=1 --cluster_k=1  \
                  --stages=2 --warps_m=4 --warps_n=2 --warps_k=1 --inst_m=16 --inst_n=8 --inst_k=8 --min_cc=75 --max_cc=1024  \
                 

           Bytes: 1073741824  bytes
           FLOPs: 3848424914944  flops
           FLOPs/Byte: 3584

         Runtime: 22.611  ms
          Memory: 44.2262 GiB/s

            Math: 170201 GFLOP/s



=============================
  Problem ID: 1

        Provider: [1;37mCUTLASS[0m
   OperationKind: [1;37mgemm[0m
       Operation: cutlass_tensorop_h1688gemm_256x128_32x2_nn_align4

          Status: [1;37mSuccess[0m
    Verification: [1;37mON[0m
     Disposition: [1;31mIncorrect[0m

reference_device: Incorrect
          cuBLAS: Not run
           cuDNN: Not run

       Arguments: --gemm_kind=universal --m=8192 --n=8192 --k=28672 --A=f16:column --B=f16:column --C=f16:column --D=f16:column  \
                  --alpha=1 --beta=0 --split_k_mode=serial --split_k_slices=1 --batch_count=1 --raster_order=heuristic  \
                  --op_class=tensorop --accum=f16 --cta_m=256 --cta_n=128 --cta_k=32 --cluster_m=1 --cluster_n=1 --cluster_k=1  \
                  --stages=2 --warps_m=4 --warps_n=2 --warps_k=1 --inst_m=16 --inst_n=8 --inst_k=8 --min_cc=75 --max_cc=1024  \
                 

           Bytes: 1073741824  bytes
           FLOPs: 3848424914944  flops
           FLOPs/Byte: 3584

         Runtime: 30.8885  ms
          Memory: 32.3745 GiB/s

            Math: 124591 GFLOP/s



=============================
  Problem ID: 1

        Provider: [1;37mCUTLASS[0m
   OperationKind: [1;37mgemm[0m
       Operation: cutlass_tensorop_h1688gemm_256x128_32x2_nn_align2

          Status: [1;37mSuccess[0m
    Verification: [1;37mON[0m
     Disposition: [1;31mIncorrect[0m

reference_device: Incorrect
          cuBLAS: Not run
           cuDNN: Not run

       Arguments: --gemm_kind=universal --m=8192 --n=8192 --k=28672 --A=f16:column --B=f16:column --C=f16:column --D=f16:column  \
                  --alpha=1 --beta=0 --split_k_mode=serial --split_k_slices=1 --batch_count=1 --raster_order=heuristic  \
                  --op_class=tensorop --accum=f16 --cta_m=256 --cta_n=128 --cta_k=32 --cluster_m=1 --cluster_n=1 --cluster_k=1  \
                  --stages=2 --warps_m=4 --warps_n=2 --warps_k=1 --inst_m=16 --inst_n=8 --inst_k=8 --min_cc=75 --max_cc=1024  \
                 

           Bytes: 1073741824  bytes
           FLOPs: 3848424914944  flops
           FLOPs/Byte: 3584

         Runtime: 37.045  ms
          Memory: 26.9942 GiB/s

            Math: 103885 GFLOP/s



=============================
  Problem ID: 1

        Provider: [1;37mCUTLASS[0m
   OperationKind: [1;37mgemm[0m
       Operation: cutlass_tensorop_h1688gemm_256x128_32x2_nn_align1

          Status: [1;37mSuccess[0m
    Verification: [1;37mON[0m
     Disposition: [1;31mIncorrect[0m

reference_device: Incorrect
          cuBLAS: Not run
           cuDNN: Not run

       Arguments: --gemm_kind=universal --m=8192 --n=8192 --k=28672 --A=f16:column --B=f16:column --C=f16:column --D=f16:column  \
                  --alpha=1 --beta=0 --split_k_mode=serial --split_k_slices=1 --batch_count=1 --raster_order=heuristic  \
                  --op_class=tensorop --accum=f16 --cta_m=256 --cta_n=128 --cta_k=32 --cluster_m=1 --cluster_n=1 --cluster_k=1  \
                  --stages=2 --warps_m=4 --warps_n=2 --warps_k=1 --inst_m=16 --inst_n=8 --inst_k=8 --min_cc=75 --max_cc=1024  \
                 

           Bytes: 1073741824  bytes
           FLOPs: 3848424914944  flops
           FLOPs/Byte: 3584

         Runtime: 48.8115  ms
          Memory: 20.487 GiB/s

            Math: 78842.6 GFLOP/s



=============================
  Problem ID: 1

        Provider: [1;37mCUTLASS[0m
   OperationKind: [1;37mgemm[0m
       Operation: cutlass_tensorop_h1688gemm_128x256_32x2_nn_align8

          Status: [1;37mSuccess[0m
    Verification: [1;37mON[0m
     Disposition: [1;31mIncorrect[0m

reference_device: Incorrect
          cuBLAS: Not run
           cuDNN: Not run

       Arguments: --gemm_kind=universal --m=8192 --n=8192 --k=28672 --A=f16:column --B=f16:column --C=f16:column --D=f16:column  \
                  --alpha=1 --beta=0 --split_k_mode=serial --split_k_slices=1 --batch_count=1 --raster_order=heuristic  \
                  --op_class=tensorop --accum=f16 --cta_m=128 --cta_n=256 --cta_k=32 --cluster_m=1 --cluster_n=1 --cluster_k=1  \
                  --stages=2 --warps_m=2 --warps_n=4 --warps_k=1 --inst_m=16 --inst_n=8 --inst_k=8 --min_cc=75 --max_cc=1024  \
                 

           Bytes: 1073741824  bytes
           FLOPs: 3848424914944  flops
           FLOPs/Byte: 3584

         Runtime: 21.8157  ms
          Memory: 45.8385 GiB/s

            Math: 176406 GFLOP/s



=============================
  Problem ID: 1

        Provider: [1;37mCUTLASS[0m
   OperationKind: [1;37mgemm[0m
       Operation: cutlass_tensorop_h1688gemm_128x256_32x2_nn_align4

          Status: [1;37mSuccess[0m
    Verification: [1;37mON[0m
     Disposition: [1;31mIncorrect[0m

reference_device: Incorrect
          cuBLAS: Not run
           cuDNN: Not run

       Arguments: --gemm_kind=universal --m=8192 --n=8192 --k=28672 --A=f16:column --B=f16:column --C=f16:column --D=f16:column  \
                  --alpha=1 --beta=0 --split_k_mode=serial --split_k_slices=1 --batch_count=1 --raster_order=heuristic  \
                  --op_class=tensorop --accum=f16 --cta_m=128 --cta_n=256 --cta_k=32 --cluster_m=1 --cluster_n=1 --cluster_k=1  \
                  --stages=2 --warps_m=2 --warps_n=4 --warps_k=1 --inst_m=16 --inst_n=8 --inst_k=8 --min_cc=75 --max_cc=1024  \
                 

           Bytes: 1073741824  bytes
           FLOPs: 3848424914944  flops
           FLOPs/Byte: 3584

         Runtime: 25.0431  ms
          Memory: 39.9311 GiB/s

            Math: 153672 GFLOP/s



=============================
  Problem ID: 1

        Provider: [1;37mCUTLASS[0m
   OperationKind: [1;37mgemm[0m
       Operation: cutlass_tensorop_h1688gemm_128x256_32x2_nn_align2

          Status: [1;37mSuccess[0m
    Verification: [1;37mON[0m
     Disposition: [1;31mIncorrect[0m

reference_device: Incorrect
          cuBLAS: Not run
           cuDNN: Not run

       Arguments: --gemm_kind=universal --m=8192 --n=8192 --k=28672 --A=f16:column --B=f16:column --C=f16:column --D=f16:column  \
                  --alpha=1 --beta=0 --split_k_mode=serial --split_k_slices=1 --batch_count=1 --raster_order=heuristic  \
                  --op_class=tensorop --accum=f16 --cta_m=128 --cta_n=256 --cta_k=32 --cluster_m=1 --cluster_n=1 --cluster_k=1  \
                  --stages=2 --warps_m=2 --warps_n=4 --warps_k=1 --inst_m=16 --inst_n=8 --inst_k=8 --min_cc=75 --max_cc=1024  \
                 

           Bytes: 1073741824  bytes
           FLOPs: 3848424914944  flops
           FLOPs/Byte: 3584

         Runtime: 34.4113  ms
          Memory: 29.0602 GiB/s

            Math: 111836 GFLOP/s



=============================
  Problem ID: 1

        Provider: [1;37mCUTLASS[0m
   OperationKind: [1;37mgemm[0m
       Operation: cutlass_tensorop_h1688gemm_128x256_32x2_nn_align1

          Status: [1;37mSuccess[0m
    Verification: [1;37mON[0m
     Disposition: [1;31mIncorrect[0m

reference_device: Incorrect
          cuBLAS: Not run
           cuDNN: Not run

       Arguments: --gemm_kind=universal --m=8192 --n=8192 --k=28672 --A=f16:column --B=f16:column --C=f16:column --D=f16:column  \
                  --alpha=1 --beta=0 --split_k_mode=serial --split_k_slices=1 --batch_count=1 --raster_order=heuristic  \
                  --op_class=tensorop --accum=f16 --cta_m=128 --cta_n=256 --cta_k=32 --cluster_m=1 --cluster_n=1 --cluster_k=1  \
                  --stages=2 --warps_m=2 --warps_n=4 --warps_k=1 --inst_m=16 --inst_n=8 --inst_k=8 --min_cc=75 --max_cc=1024  \
                 

           Bytes: 1073741824  bytes
           FLOPs: 3848424914944  flops
           FLOPs/Byte: 3584

         Runtime: 38.3828  ms
          Memory: 26.0533 GiB/s

            Math: 100264 GFLOP/s



=============================
  Problem ID: 1

        Provider: [1;37mCUTLASS[0m
   OperationKind: [1;37mgemm[0m
       Operation: cutlass_tensorop_h1688gemm_128x128_32x2_nn_align8

          Status: [1;37mSuccess[0m
    Verification: [1;37mON[0m
     Disposition: [1;31mIncorrect[0m

reference_device: Incorrect
          cuBLAS: Not run
           cuDNN: Not run

       Arguments: --gemm_kind=universal --m=8192 --n=8192 --k=28672 --A=f16:column --B=f16:column --C=f16:column --D=f16:column  \
                  --alpha=1 --beta=0 --split_k_mode=serial --split_k_slices=1 --batch_count=1 --raster_order=heuristic  \
                  --op_class=tensorop --accum=f16 --cta_m=128 --cta_n=128 --cta_k=32 --cluster_m=1 --cluster_n=1 --cluster_k=1  \
                  --stages=2 --warps_m=2 --warps_n=2 --warps_k=1 --inst_m=16 --inst_n=8 --inst_k=8 --min_cc=75 --max_cc=1024  \
                 

           Bytes: 1073741824  bytes
           FLOPs: 3848424914944  flops
           FLOPs/Byte: 3584

         Runtime: 20.3049  ms
          Memory: 49.2492 GiB/s

            Math: 189532 GFLOP/s



=============================
  Problem ID: 1

        Provider: [1;37mCUTLASS[0m
   OperationKind: [1;37mgemm[0m
       Operation: cutlass_tensorop_h1688gemm_128x128_32x2_nn_align4

          Status: [1;37mSuccess[0m
    Verification: [1;37mON[0m
     Disposition: [1;31mIncorrect[0m

reference_device: Incorrect
          cuBLAS: Not run
           cuDNN: Not run

       Arguments: --gemm_kind=universal --m=8192 --n=8192 --k=28672 --A=f16:column --B=f16:column --C=f16:column --D=f16:column  \
                  --alpha=1 --beta=0 --split_k_mode=serial --split_k_slices=1 --batch_count=1 --raster_order=heuristic  \
                  --op_class=tensorop --accum=f16 --cta_m=128 --cta_n=128 --cta_k=32 --cluster_m=1 --cluster_n=1 --cluster_k=1  \
                  --stages=2 --warps_m=2 --warps_n=2 --warps_k=1 --inst_m=16 --inst_n=8 --inst_k=8 --min_cc=75 --max_cc=1024  \
                 

           Bytes: 1073741824  bytes
           FLOPs: 3848424914944  flops
           FLOPs/Byte: 3584

         Runtime: 22.4748  ms
          Memory: 44.4944 GiB/s

            Math: 171233 GFLOP/s



=============================
  Problem ID: 1

        Provider: [1;37mCUTLASS[0m
   OperationKind: [1;37mgemm[0m
       Operation: cutlass_tensorop_h1688gemm_128x128_32x2_nn_align2

          Status: [1;37mSuccess[0m
    Verification: [1;37mON[0m
     Disposition: [1;31mIncorrect[0m

reference_device: Incorrect
          cuBLAS: Not run
           cuDNN: Not run

       Arguments: --gemm_kind=universal --m=8192 --n=8192 --k=28672 --A=f16:column --B=f16:column --C=f16:column --D=f16:column  \
                  --alpha=1 --beta=0 --split_k_mode=serial --split_k_slices=1 --batch_count=1 --raster_order=heuristic  \
                  --op_class=tensorop --accum=f16 --cta_m=128 --cta_n=128 --cta_k=32 --cluster_m=1 --cluster_n=1 --cluster_k=1  \
                  --stages=2 --warps_m=2 --warps_n=2 --warps_k=1 --inst_m=16 --inst_n=8 --inst_k=8 --min_cc=75 --max_cc=1024  \
                 

           Bytes: 1073741824  bytes
           FLOPs: 3848424914944  flops
           FLOPs/Byte: 3584

         Runtime: 30.1559  ms
          Memory: 33.161 GiB/s

            Math: 127618 GFLOP/s



=============================
  Problem ID: 1

        Provider: [1;37mCUTLASS[0m
   OperationKind: [1;37mgemm[0m
       Operation: cutlass_tensorop_h1688gemm_128x128_32x2_nn_align1

          Status: [1;37mSuccess[0m
    Verification: [1;37mON[0m
     Disposition: [1;31mIncorrect[0m

reference_device: Incorrect
          cuBLAS: Not run
           cuDNN: Not run

       Arguments: --gemm_kind=universal --m=8192 --n=8192 --k=28672 --A=f16:column --B=f16:column --C=f16:column --D=f16:column  \
                  --alpha=1 --beta=0 --split_k_mode=serial --split_k_slices=1 --batch_count=1 --raster_order=heuristic  \
                  --op_class=tensorop --accum=f16 --cta_m=128 --cta_n=128 --cta_k=32 --cluster_m=1 --cluster_n=1 --cluster_k=1  \
                  --stages=2 --warps_m=2 --warps_n=2 --warps_k=1 --inst_m=16 --inst_n=8 --inst_k=8 --min_cc=75 --max_cc=1024  \
                 

           Bytes: 1073741824  bytes
           FLOPs: 3848424914944  flops
           FLOPs/Byte: 3584

         Runtime: 49.907  ms
          Memory: 20.0373 GiB/s

            Math: 77111.9 GFLOP/s



=============================
  Problem ID: 1

        Provider: [1;37mCUTLASS[0m
   OperationKind: [1;37mgemm[0m
       Operation: cutlass_tensorop_h1688gemm_64x256_32x2_nn_align8

          Status: [1;37mSuccess[0m
    Verification: [1;37mON[0m
     Disposition: [1;31mIncorrect[0m

reference_device: Incorrect
          cuBLAS: Not run
           cuDNN: Not run

       Arguments: --gemm_kind=universal --m=8192 --n=8192 --k=28672 --A=f16:column --B=f16:column --C=f16:column --D=f16:column  \
                  --alpha=1 --beta=0 --split_k_mode=serial --split_k_slices=1 --batch_count=1 --raster_order=heuristic  \
                  --op_class=tensorop --accum=f16 --cta_m=64 --cta_n=256 --cta_k=32 --cluster_m=1 --cluster_n=1 --cluster_k=1  \
                  --stages=2 --warps_m=1 --warps_n=4 --warps_k=1 --inst_m=16 --inst_n=8 --inst_k=8 --min_cc=75 --max_cc=1024  \
                 

           Bytes: 1073741824  bytes
           FLOPs: 3848424914944  flops
           FLOPs/Byte: 3584

         Runtime: 21.332  ms
          Memory: 46.878 GiB/s

            Math: 180406 GFLOP/s



=============================
  Problem ID: 1

        Provider: [1;37mCUTLASS[0m
   OperationKind: [1;37mgemm[0m
       Operation: cutlass_tensorop_h1688gemm_64x256_32x2_nn_align4

          Status: [1;37mSuccess[0m
    Verification: [1;37mON[0m
     Disposition: [1;31mIncorrect[0m

reference_device: Incorrect
          cuBLAS: Not run
           cuDNN: Not run

       Arguments: --gemm_kind=universal --m=8192 --n=8192 --k=28672 --A=f16:column --B=f16:column --C=f16:column --D=f16:column  \
                  --alpha=1 --beta=0 --split_k_mode=serial --split_k_slices=1 --batch_count=1 --raster_order=heuristic  \
                  --op_class=tensorop --accum=f16 --cta_m=64 --cta_n=256 --cta_k=32 --cluster_m=1 --cluster_n=1 --cluster_k=1  \
                  --stages=2 --warps_m=1 --warps_n=4 --warps_k=1 --inst_m=16 --inst_n=8 --inst_k=8 --min_cc=75 --max_cc=1024  \
                 

           Bytes: 1073741824  bytes
           FLOPs: 3848424914944  flops
           FLOPs/Byte: 3584

         Runtime: 23.5097  ms
          Memory: 42.5356 GiB/s

            Math: 163695 GFLOP/s



=============================
  Problem ID: 1

        Provider: [1;37mCUTLASS[0m
   OperationKind: [1;37mgemm[0m
       Operation: cutlass_tensorop_h1688gemm_64x256_32x2_nn_align2

          Status: [1;37mSuccess[0m
    Verification: [1;37mON[0m
     Disposition: [1;31mIncorrect[0m

reference_device: Incorrect
          cuBLAS: Not run
           cuDNN: Not run

       Arguments: --gemm_kind=universal --m=8192 --n=8192 --k=28672 --A=f16:column --B=f16:column --C=f16:column --D=f16:column  \
                  --alpha=1 --beta=0 --split_k_mode=serial --split_k_slices=1 --batch_count=1 --raster_order=heuristic  \
                  --op_class=tensorop --accum=f16 --cta_m=64 --cta_n=256 --cta_k=32 --cluster_m=1 --cluster_n=1 --cluster_k=1  \
                  --stages=2 --warps_m=1 --warps_n=4 --warps_k=1 --inst_m=16 --inst_n=8 --inst_k=8 --min_cc=75 --max_cc=1024  \
                 

           Bytes: 1073741824  bytes
           FLOPs: 3848424914944  flops
           FLOPs/Byte: 3584

         Runtime: 30.8642  ms
          Memory: 32.4 GiB/s

            Math: 124689 GFLOP/s



=============================
  Problem ID: 1

        Provider: [1;37mCUTLASS[0m
   OperationKind: [1;37mgemm[0m
       Operation: cutlass_tensorop_h1688gemm_64x256_32x2_nn_align1

          Status: [1;37mSuccess[0m
    Verification: [1;37mON[0m
     Disposition: [1;31mIncorrect[0m

reference_device: Incorrect
          cuBLAS: Not run
           cuDNN: Not run

       Arguments: --gemm_kind=universal --m=8192 --n=8192 --k=28672 --A=f16:column --B=f16:column --C=f16:column --D=f16:column  \
                  --alpha=1 --beta=0 --split_k_mode=serial --split_k_slices=1 --batch_count=1 --raster_order=heuristic  \
                  --op_class=tensorop --accum=f16 --cta_m=64 --cta_n=256 --cta_k=32 --cluster_m=1 --cluster_n=1 --cluster_k=1  \
                  --stages=2 --warps_m=1 --warps_n=4 --warps_k=1 --inst_m=16 --inst_n=8 --inst_k=8 --min_cc=75 --max_cc=1024  \
                 

           Bytes: 1073741824  bytes
           FLOPs: 3848424914944  flops
           FLOPs/Byte: 3584

         Runtime: 50.0696  ms
          Memory: 19.9722 GiB/s

            Math: 76861.5 GFLOP/s



=============================
  Problem ID: 1

        Provider: [1;37mCUTLASS[0m
   OperationKind: [1;37mgemm[0m
       Operation: cutlass_tensorop_h1688gemm_256x64_32x2_nn_align8

          Status: [1;37mSuccess[0m
    Verification: [1;37mON[0m
     Disposition: [1;31mIncorrect[0m

reference_device: Incorrect
          cuBLAS: Not run
           cuDNN: Not run

       Arguments: --gemm_kind=universal --m=8192 --n=8192 --k=28672 --A=f16:column --B=f16:column --C=f16:column --D=f16:column  \
                  --alpha=1 --beta=0 --split_k_mode=serial --split_k_slices=1 --batch_count=1 --raster_order=heuristic  \
                  --op_class=tensorop --accum=f16 --cta_m=256 --cta_n=64 --cta_k=32 --cluster_m=1 --cluster_n=1 --cluster_k=1  \
                  --stages=2 --warps_m=4 --warps_n=1 --warps_k=1 --inst_m=16 --inst_n=8 --inst_k=8 --min_cc=75 --max_cc=1024  \
                 

           Bytes: 1073741824  bytes
           FLOPs: 3848424914944  flops
           FLOPs/Byte: 3584

         Runtime: 28.0477  ms
          Memory: 35.6536 GiB/s

            Math: 137210 GFLOP/s



=============================
  Problem ID: 1

        Provider: [1;37mCUTLASS[0m
   OperationKind: [1;37mgemm[0m
       Operation: cutlass_tensorop_h1688gemm_256x64_32x2_nn_align4

          Status: [1;37mSuccess[0m
    Verification: [1;37mON[0m
     Disposition: [1;31mIncorrect[0m

reference_device: Incorrect
          cuBLAS: Not run
           cuDNN: Not run

       Arguments: --gemm_kind=universal --m=8192 --n=8192 --k=28672 --A=f16:column --B=f16:column --C=f16:column --D=f16:column  \
                  --alpha=1 --beta=0 --split_k_mode=serial --split_k_slices=1 --batch_count=1 --raster_order=heuristic  \
                  --op_class=tensorop --accum=f16 --cta_m=256 --cta_n=64 --cta_k=32 --cluster_m=1 --cluster_n=1 --cluster_k=1  \
                  --stages=2 --warps_m=4 --warps_n=1 --warps_k=1 --inst_m=16 --inst_n=8 --inst_k=8 --min_cc=75 --max_cc=1024  \
                 

           Bytes: 1073741824  bytes
           FLOPs: 3848424914944  flops
           FLOPs/Byte: 3584

         Runtime: 35.0282  ms
          Memory: 28.5484 GiB/s

            Math: 109867 GFLOP/s



=============================
  Problem ID: 1

        Provider: [1;37mCUTLASS[0m
   OperationKind: [1;37mgemm[0m
       Operation: cutlass_tensorop_h1688gemm_256x64_32x2_nn_align2

          Status: [1;37mSuccess[0m
    Verification: [1;37mON[0m
     Disposition: [1;31mIncorrect[0m

reference_device: Incorrect
          cuBLAS: Not run
           cuDNN: Not run

       Arguments: --gemm_kind=universal --m=8192 --n=8192 --k=28672 --A=f16:column --B=f16:column --C=f16:column --D=f16:column  \
                  --alpha=1 --beta=0 --split_k_mode=serial --split_k_slices=1 --batch_count=1 --raster_order=heuristic  \
                  --op_class=tensorop --accum=f16 --cta_m=256 --cta_n=64 --cta_k=32 --cluster_m=1 --cluster_n=1 --cluster_k=1  \
                  --stages=2 --warps_m=4 --warps_n=1 --warps_k=1 --inst_m=16 --inst_n=8 --inst_k=8 --min_cc=75 --max_cc=1024  \
                 

           Bytes: 1073741824  bytes
           FLOPs: 3848424914944  flops
           FLOPs/Byte: 3584

         Runtime: 40.3535  ms
          Memory: 24.781 GiB/s

            Math: 95367.8 GFLOP/s



=============================
  Problem ID: 1

        Provider: [1;37mCUTLASS[0m
   OperationKind: [1;37mgemm[0m
       Operation: cutlass_tensorop_h1688gemm_256x64_32x2_nn_align1

          Status: [1;37mSuccess[0m
    Verification: [1;37mON[0m
     Disposition: [1;31mIncorrect[0m

reference_device: Incorrect
          cuBLAS: Not run
           cuDNN: Not run

       Arguments: --gemm_kind=universal --m=8192 --n=8192 --k=28672 --A=f16:column --B=f16:column --C=f16:column --D=f16:column  \
                  --alpha=1 --beta=0 --split_k_mode=serial --split_k_slices=1 --batch_count=1 --raster_order=heuristic  \
                  --op_class=tensorop --accum=f16 --cta_m=256 --cta_n=64 --cta_k=32 --cluster_m=1 --cluster_n=1 --cluster_k=1  \
                  --stages=2 --warps_m=4 --warps_n=1 --warps_k=1 --inst_m=16 --inst_n=8 --inst_k=8 --min_cc=75 --max_cc=1024  \
                 

           Bytes: 1073741824  bytes
           FLOPs: 3848424914944  flops
           FLOPs/Byte: 3584

         Runtime: 67.6174  ms
          Memory: 14.7891 GiB/s

            Math: 56914.7 GFLOP/s



=============================
  Problem ID: 1

        Provider: [1;37mCUTLASS[0m
   OperationKind: [1;37mgemm[0m
       Operation: cutlass_tensorop_h1688gemm_64x128_32x2_nn_align8

          Status: [1;37mSuccess[0m
    Verification: [1;37mON[0m
     Disposition: [1;31mIncorrect[0m

reference_device: Incorrect
          cuBLAS: Not run
           cuDNN: Not run

       Arguments: --gemm_kind=universal --m=8192 --n=8192 --k=28672 --A=f16:column --B=f16:column --C=f16:column --D=f16:column  \
                  --alpha=1 --beta=0 --split_k_mode=serial --split_k_slices=1 --batch_count=1 --raster_order=heuristic  \
                  --op_class=tensorop --accum=f16 --cta_m=64 --cta_n=128 --cta_k=32 --cluster_m=1 --cluster_n=1 --cluster_k=1  \
                  --stages=2 --warps_m=2 --warps_n=2 --warps_k=1 --inst_m=16 --inst_n=8 --inst_k=8 --min_cc=75 --max_cc=1024  \
                 

           Bytes: 1073741824  bytes
           FLOPs: 3848424914944  flops
           FLOPs/Byte: 3584

         Runtime: 26.1403  ms
          Memory: 38.2552 GiB/s

            Math: 147222 GFLOP/s



=============================
  Problem ID: 1

        Provider: [1;37mCUTLASS[0m
   OperationKind: [1;37mgemm[0m
       Operation: cutlass_tensorop_h1688gemm_64x128_32x2_nn_align4

          Status: [1;37mSuccess[0m
    Verification: [1;37mON[0m
     Disposition: [1;31mIncorrect[0m

reference_device: Incorrect
          cuBLAS: Not run
           cuDNN: Not run

       Arguments: --gemm_kind=universal --m=8192 --n=8192 --k=28672 --A=f16:column --B=f16:column --C=f16:column --D=f16:column  \
                  --alpha=1 --beta=0 --split_k_mode=serial --split_k_slices=1 --batch_count=1 --raster_order=heuristic  \
                  --op_class=tensorop --accum=f16 --cta_m=64 --cta_n=128 --cta_k=32 --cluster_m=1 --cluster_n=1 --cluster_k=1  \
                  --stages=2 --warps_m=2 --warps_n=2 --warps_k=1 --inst_m=16 --inst_n=8 --inst_k=8 --min_cc=75 --max_cc=1024  \
                 

           Bytes: 1073741824  bytes
           FLOPs: 3848424914944  flops
           FLOPs/Byte: 3584

         Runtime: 28.4679  ms
          Memory: 35.1273 GiB/s

            Math: 135185 GFLOP/s



=============================
  Problem ID: 1

        Provider: [1;37mCUTLASS[0m
   OperationKind: [1;37mgemm[0m
       Operation: cutlass_tensorop_h1688gemm_64x128_32x2_nn_align2

          Status: [1;37mSuccess[0m
    Verification: [1;37mON[0m
     Disposition: [1;31mIncorrect[0m

reference_device: Incorrect
          cuBLAS: Not run
           cuDNN: Not run

       Arguments: --gemm_kind=universal --m=8192 --n=8192 --k=28672 --A=f16:column --B=f16:column --C=f16:column --D=f16:column  \
                  --alpha=1 --beta=0 --split_k_mode=serial --split_k_slices=1 --batch_count=1 --raster_order=heuristic  \
                  --op_class=tensorop --accum=f16 --cta_m=64 --cta_n=128 --cta_k=32 --cluster_m=1 --cluster_n=1 --cluster_k=1  \
                  --stages=2 --warps_m=2 --warps_n=2 --warps_k=1 --inst_m=16 --inst_n=8 --inst_k=8 --min_cc=75 --max_cc=1024  \
                 

           Bytes: 1073741824  bytes
           FLOPs: 3848424914944  flops
           FLOPs/Byte: 3584

         Runtime: 39.5574  ms
          Memory: 25.2797 GiB/s

            Math: 97287 GFLOP/s



=============================
  Problem ID: 1

        Provider: [1;37mCUTLASS[0m
   OperationKind: [1;37mgemm[0m
       Operation: cutlass_tensorop_h1688gemm_64x128_32x2_nn_align1

          Status: [1;37mSuccess[0m
    Verification: [1;37mON[0m
     Disposition: [1;31mIncorrect[0m

reference_device: Incorrect
          cuBLAS: Not run
           cuDNN: Not run

       Arguments: --gemm_kind=universal --m=8192 --n=8192 --k=28672 --A=f16:column --B=f16:column --C=f16:column --D=f16:column  \
                  --alpha=1 --beta=0 --split_k_mode=serial --split_k_slices=1 --batch_count=1 --raster_order=heuristic  \
                  --op_class=tensorop --accum=f16 --cta_m=64 --cta_n=128 --cta_k=32 --cluster_m=1 --cluster_n=1 --cluster_k=1  \
                  --stages=2 --warps_m=2 --warps_n=2 --warps_k=1 --inst_m=16 --inst_n=8 --inst_k=8 --min_cc=75 --max_cc=1024  \
                 

           Bytes: 1073741824  bytes
           FLOPs: 3848424914944  flops
           FLOPs/Byte: 3584

         Runtime: 64.4943  ms
          Memory: 15.5052 GiB/s

            Math: 59670.8 GFLOP/s



=============================
  Problem ID: 1

        Provider: [1;37mCUTLASS[0m
   OperationKind: [1;37mgemm[0m
       Operation: cutlass_tensorop_h1688gemm_128x64_32x2_nn_align8

          Status: [1;37mSuccess[0m
    Verification: [1;37mON[0m
     Disposition: [1;31mIncorrect[0m

reference_device: Incorrect
          cuBLAS: Not run
           cuDNN: Not run

       Arguments: --gemm_kind=universal --m=8192 --n=8192 --k=28672 --A=f16:column --B=f16:column --C=f16:column --D=f16:column  \
                  --alpha=1 --beta=0 --split_k_mode=serial --split_k_slices=1 --batch_count=1 --raster_order=heuristic  \
                  --op_class=tensorop --accum=f16 --cta_m=128 --cta_n=64 --cta_k=32 --cluster_m=1 --cluster_n=1 --cluster_k=1  \
                  --stages=2 --warps_m=2 --warps_n=2 --warps_k=1 --inst_m=16 --inst_n=8 --inst_k=8 --min_cc=75 --max_cc=1024  \
                 

           Bytes: 1073741824  bytes
           FLOPs: 3848424914944  flops
           FLOPs/Byte: 3584

         Runtime: 32.33  ms
          Memory: 30.931 GiB/s

            Math: 119036 GFLOP/s



=============================
  Problem ID: 1

        Provider: [1;37mCUTLASS[0m
   OperationKind: [1;37mgemm[0m
       Operation: cutlass_tensorop_h1688gemm_128x64_32x2_nn_align4

          Status: [1;37mSuccess[0m
    Verification: [1;37mON[0m
     Disposition: [1;31mIncorrect[0m

reference_device: Incorrect
          cuBLAS: Not run
           cuDNN: Not run

       Arguments: --gemm_kind=universal --m=8192 --n=8192 --k=28672 --A=f16:column --B=f16:column --C=f16:column --D=f16:column  \
                  --alpha=1 --beta=0 --split_k_mode=serial --split_k_slices=1 --batch_count=1 --raster_order=heuristic  \
                  --op_class=tensorop --accum=f16 --cta_m=128 --cta_n=64 --cta_k=32 --cluster_m=1 --cluster_n=1 --cluster_k=1  \
                  --stages=2 --warps_m=2 --warps_n=2 --warps_k=1 --inst_m=16 --inst_n=8 --inst_k=8 --min_cc=75 --max_cc=1024  \
                 

           Bytes: 1073741824  bytes
           FLOPs: 3848424914944  flops
           FLOPs/Byte: 3584

         Runtime: 32.0475  ms
          Memory: 31.2037 GiB/s

            Math: 120085 GFLOP/s



=============================
  Problem ID: 1

        Provider: [1;37mCUTLASS[0m
   OperationKind: [1;37mgemm[0m
       Operation: cutlass_tensorop_h1688gemm_128x64_32x2_nn_align2

          Status: [1;37mSuccess[0m
    Verification: [1;37mON[0m
     Disposition: [1;31mIncorrect[0m

reference_device: Incorrect
          cuBLAS: Not run
           cuDNN: Not run

       Arguments: --gemm_kind=universal --m=8192 --n=8192 --k=28672 --A=f16:column --B=f16:column --C=f16:column --D=f16:column  \
                  --alpha=1 --beta=0 --split_k_mode=serial --split_k_slices=1 --batch_count=1 --raster_order=heuristic  \
                  --op_class=tensorop --accum=f16 --cta_m=128 --cta_n=64 --cta_k=32 --cluster_m=1 --cluster_n=1 --cluster_k=1  \
                  --stages=2 --warps_m=2 --warps_n=2 --warps_k=1 --inst_m=16 --inst_n=8 --inst_k=8 --min_cc=75 --max_cc=1024  \
                 

           Bytes: 1073741824  bytes
           FLOPs: 3848424914944  flops
           FLOPs/Byte: 3584

         Runtime: 45.5659  ms
          Memory: 21.9463 GiB/s

            Math: 84458.5 GFLOP/s



=============================
  Problem ID: 1

        Provider: [1;37mCUTLASS[0m
   OperationKind: [1;37mgemm[0m
       Operation: cutlass_tensorop_h1688gemm_128x64_32x2_nn_align1

          Status: [1;37mSuccess[0m
    Verification: [1;37mON[0m
     Disposition: [1;31mIncorrect[0m

reference_device: Incorrect
          cuBLAS: Not run
           cuDNN: Not run

       Arguments: --gemm_kind=universal --m=8192 --n=8192 --k=28672 --A=f16:column --B=f16:column --C=f16:column --D=f16:column  \
                  --alpha=1 --beta=0 --split_k_mode=serial --split_k_slices=1 --batch_count=1 --raster_order=heuristic  \
                  --op_class=tensorop --accum=f16 --cta_m=128 --cta_n=64 --cta_k=32 --cluster_m=1 --cluster_n=1 --cluster_k=1  \
                  --stages=2 --warps_m=2 --warps_n=2 --warps_k=1 --inst_m=16 --inst_n=8 --inst_k=8 --min_cc=75 --max_cc=1024  \
                 

           Bytes: 1073741824  bytes
           FLOPs: 3848424914944  flops
           FLOPs/Byte: 3584

         Runtime: 77.3764  ms
          Memory: 12.9238 GiB/s

            Math: 49736.4 GFLOP/s



=============================
  Problem ID: 1

        Provider: [1;37mCUTLASS[0m
   OperationKind: [1;37mgemm[0m
       Operation: cutlass_tensorop_h1688gemm_64x64_32x2_nn_align8

          Status: [1;37mSuccess[0m
    Verification: [1;37mON[0m
     Disposition: [1;31mIncorrect[0m

reference_device: Incorrect
          cuBLAS: Not run
           cuDNN: Not run

       Arguments: --gemm_kind=universal --m=8192 --n=8192 --k=28672 --A=f16:column --B=f16:column --C=f16:column --D=f16:column  \
                  --alpha=1 --beta=0 --split_k_mode=serial --split_k_slices=1 --batch_count=1 --raster_order=heuristic  \
                  --op_class=tensorop --accum=f16 --cta_m=64 --cta_n=64 --cta_k=32 --cluster_m=1 --cluster_n=1 --cluster_k=1  \
                  --stages=2 --warps_m=2 --warps_n=2 --warps_k=1 --inst_m=16 --inst_n=8 --inst_k=8 --min_cc=75 --max_cc=1024  \
                 

           Bytes: 1073741824  bytes
           FLOPs: 3848424914944  flops
           FLOPs/Byte: 3584

         Runtime: 36.2491  ms
          Memory: 27.5869 GiB/s

            Math: 106166 GFLOP/s



=============================
  Problem ID: 1

        Provider: [1;37mCUTLASS[0m
   OperationKind: [1;37mgemm[0m
       Operation: cutlass_tensorop_h1688gemm_64x64_32x2_nn_align4

          Status: [1;37mSuccess[0m
    Verification: [1;37mON[0m
     Disposition: [1;31mIncorrect[0m

reference_device: Incorrect
          cuBLAS: Not run
           cuDNN: Not run

       Arguments: --gemm_kind=universal --m=8192 --n=8192 --k=28672 --A=f16:column --B=f16:column --C=f16:column --D=f16:column  \
                  --alpha=1 --beta=0 --split_k_mode=serial --split_k_slices=1 --batch_count=1 --raster_order=heuristic  \
                  --op_class=tensorop --accum=f16 --cta_m=64 --cta_n=64 --cta_k=32 --cluster_m=1 --cluster_n=1 --cluster_k=1  \
                  --stages=2 --warps_m=2 --warps_n=2 --warps_k=1 --inst_m=16 --inst_n=8 --inst_k=8 --min_cc=75 --max_cc=1024  \
                 

           Bytes: 1073741824  bytes
           FLOPs: 3848424914944  flops
           FLOPs/Byte: 3584

         Runtime: 41.4608  ms
          Memory: 24.1191 GiB/s

            Math: 92820.7 GFLOP/s



=============================
  Problem ID: 1

        Provider: [1;37mCUTLASS[0m
   OperationKind: [1;37mgemm[0m
       Operation: cutlass_tensorop_h1688gemm_64x64_32x2_nn_align2

          Status: [1;37mSuccess[0m
    Verification: [1;37mON[0m
     Disposition: [1;31mIncorrect[0m

reference_device: Incorrect
          cuBLAS: Not run
           cuDNN: Not run

       Arguments: --gemm_kind=universal --m=8192 --n=8192 --k=28672 --A=f16:column --B=f16:column --C=f16:column --D=f16:column  \
                  --alpha=1 --beta=0 --split_k_mode=serial --split_k_slices=1 --batch_count=1 --raster_order=heuristic  \
                  --op_class=tensorop --accum=f16 --cta_m=64 --cta_n=64 --cta_k=32 --cluster_m=1 --cluster_n=1 --cluster_k=1  \
                  --stages=2 --warps_m=2 --warps_n=2 --warps_k=1 --inst_m=16 --inst_n=8 --inst_k=8 --min_cc=75 --max_cc=1024  \
                 

           Bytes: 1073741824  bytes
           FLOPs: 3848424914944  flops
           FLOPs/Byte: 3584

         Runtime: 58.8645  ms
          Memory: 16.9882 GiB/s

            Math: 65377.6 GFLOP/s



=============================
  Problem ID: 1

        Provider: [1;37mCUTLASS[0m
   OperationKind: [1;37mgemm[0m
       Operation: cutlass_tensorop_h1688gemm_64x64_32x2_nn_align1

          Status: [1;37mSuccess[0m
    Verification: [1;37mON[0m
     Disposition: [1;31mIncorrect[0m

reference_device: Incorrect
          cuBLAS: Not run
           cuDNN: Not run

       Arguments: --gemm_kind=universal --m=8192 --n=8192 --k=28672 --A=f16:column --B=f16:column --C=f16:column --D=f16:column  \
                  --alpha=1 --beta=0 --split_k_mode=serial --split_k_slices=1 --batch_count=1 --raster_order=heuristic  \
                  --op_class=tensorop --accum=f16 --cta_m=64 --cta_n=64 --cta_k=32 --cluster_m=1 --cluster_n=1 --cluster_k=1  \
                  --stages=2 --warps_m=2 --warps_n=2 --warps_k=1 --inst_m=16 --inst_n=8 --inst_k=8 --min_cc=75 --max_cc=1024  \
                 

           Bytes: 1073741824  bytes
           FLOPs: 3848424914944  flops
           FLOPs/Byte: 3584

         Runtime: 94.6266  ms
          Memory: 10.5679 GiB/s

            Math: 40669.6 GFLOP/s



=============================
  Problem ID: 1

        Provider: [1;37mCUTLASS[0m
   OperationKind: [1;37mgemm[0m
       Operation: cutlass_tensorop_h1688gemm_64x128_64x2_nn_align8

          Status: [1;37mSuccess[0m
    Verification: [1;37mON[0m
     Disposition: [1;31mIncorrect[0m

reference_device: Incorrect
          cuBLAS: Not run
           cuDNN: Not run

       Arguments: --gemm_kind=universal --m=8192 --n=8192 --k=28672 --A=f16:column --B=f16:column --C=f16:column --D=f16:column  \
                  --alpha=1 --beta=0 --split_k_mode=serial --split_k_slices=1 --batch_count=1 --raster_order=heuristic  \
                  --op_class=tensorop --accum=f16 --cta_m=64 --cta_n=128 --cta_k=64 --cluster_m=1 --cluster_n=1 --cluster_k=1  \
                  --stages=2 --warps_m=1 --warps_n=2 --warps_k=2 --inst_m=16 --inst_n=8 --inst_k=8 --min_cc=75 --max_cc=1024  \
                 

           Bytes: 1073741824  bytes
           FLOPs: 3848424914944  flops
           FLOPs/Byte: 3584

         Runtime: 31.752  ms
          Memory: 31.4941 GiB/s

            Math: 121203 GFLOP/s



=============================
  Problem ID: 1

        Provider: [1;37mCUTLASS[0m
   OperationKind: [1;37mgemm[0m
       Operation: cutlass_tensorop_h1688gemm_64x128_64x2_nn_align4

          Status: [1;37mSuccess[0m
    Verification: [1;37mON[0m
     Disposition: [1;31mIncorrect[0m

reference_device: Incorrect
          cuBLAS: Not run
           cuDNN: Not run

       Arguments: --gemm_kind=universal --m=8192 --n=8192 --k=28672 --A=f16:column --B=f16:column --C=f16:column --D=f16:column  \
                  --alpha=1 --beta=0 --split_k_mode=serial --split_k_slices=1 --batch_count=1 --raster_order=heuristic  \
                  --op_class=tensorop --accum=f16 --cta_m=64 --cta_n=128 --cta_k=64 --cluster_m=1 --cluster_n=1 --cluster_k=1  \
                  --stages=2 --warps_m=1 --warps_n=2 --warps_k=2 --inst_m=16 --inst_n=8 --inst_k=8 --min_cc=75 --max_cc=1024  \
                 

           Bytes: 1073741824  bytes
           FLOPs: 3848424914944  flops
           FLOPs/Byte: 3584

         Runtime: 27.1809  ms
          Memory: 36.7906 GiB/s

            Math: 141586 GFLOP/s



=============================
  Problem ID: 1

        Provider: [1;37mCUTLASS[0m
   OperationKind: [1;37mgemm[0m
       Operation: cutlass_tensorop_h1688gemm_64x128_64x2_nn_align2

          Status: [1;37mSuccess[0m
    Verification: [1;37mON[0m
     Disposition: [1;31mIncorrect[0m

reference_device: Incorrect
          cuBLAS: Not run
           cuDNN: Not run

       Arguments: --gemm_kind=universal --m=8192 --n=8192 --k=28672 --A=f16:column --B=f16:column --C=f16:column --D=f16:column  \
                  --alpha=1 --beta=0 --split_k_mode=serial --split_k_slices=1 --batch_count=1 --raster_order=heuristic  \
                  --op_class=tensorop --accum=f16 --cta_m=64 --cta_n=128 --cta_k=64 --cluster_m=1 --cluster_n=1 --cluster_k=1  \
                  --stages=2 --warps_m=1 --warps_n=2 --warps_k=2 --inst_m=16 --inst_n=8 --inst_k=8 --min_cc=75 --max_cc=1024  \
                 

           Bytes: 1073741824  bytes
           FLOPs: 3848424914944  flops
           FLOPs/Byte: 3584

         Runtime: 33.4075  ms
          Memory: 29.9334 GiB/s

            Math: 115196 GFLOP/s



=============================
  Problem ID: 1

        Provider: [1;37mCUTLASS[0m
   OperationKind: [1;37mgemm[0m
       Operation: cutlass_tensorop_h1688gemm_64x128_64x2_nn_align1

          Status: [1;37mSuccess[0m
    Verification: [1;37mON[0m
     Disposition: [1;31mIncorrect[0m

reference_device: Incorrect
          cuBLAS: Not run
           cuDNN: Not run

       Arguments: --gemm_kind=universal --m=8192 --n=8192 --k=28672 --A=f16:column --B=f16:column --C=f16:column --D=f16:column  \
                  --alpha=1 --beta=0 --split_k_mode=serial --split_k_slices=1 --batch_count=1 --raster_order=heuristic  \
                  --op_class=tensorop --accum=f16 --cta_m=64 --cta_n=128 --cta_k=64 --cluster_m=1 --cluster_n=1 --cluster_k=1  \
                  --stages=2 --warps_m=1 --warps_n=2 --warps_k=2 --inst_m=16 --inst_n=8 --inst_k=8 --min_cc=75 --max_cc=1024  \
                 

           Bytes: 1073741824  bytes
           FLOPs: 3848424914944  flops
           FLOPs/Byte: 3584

         Runtime: 54.0022  ms
          Memory: 18.5178 GiB/s

            Math: 71264.3 GFLOP/s



=============================
  Problem ID: 1

        Provider: [1;37mCUTLASS[0m
   OperationKind: [1;37mgemm[0m
       Operation: cutlass_tensorop_h1688gemm_256x128_32x2_nt_align8

          Status: [1;37mSuccess[0m
    Verification: [1;37mON[0m
     Disposition: [1;31mIncorrect[0m

reference_device: Incorrect
          cuBLAS: Not run
           cuDNN: Not run

       Arguments: --gemm_kind=universal --m=8192 --n=8192 --k=28672 --A=f16:column --B=f16:row --C=f16:column --D=f16:column  \
                  --alpha=1 --beta=0 --split_k_mode=serial --split_k_slices=1 --batch_count=1 --raster_order=heuristic  \
                  --op_class=tensorop --accum=f16 --cta_m=256 --cta_n=128 --cta_k=32 --cluster_m=1 --cluster_n=1 --cluster_k=1  \
                  --stages=2 --warps_m=4 --warps_n=2 --warps_k=1 --inst_m=16 --inst_n=8 --inst_k=8 --min_cc=75 --max_cc=1024  \
                 

           Bytes: 1073741824  bytes
           FLOPs: 3848424914944  flops
           FLOPs/Byte: 3584

         Runtime: 21.3223  ms
          Memory: 46.8992 GiB/s

            Math: 180488 GFLOP/s



=============================
  Problem ID: 1

        Provider: [1;37mCUTLASS[0m
   OperationKind: [1;37mgemm[0m
       Operation: cutlass_tensorop_h1688gemm_256x128_32x2_nt_align4

          Status: [1;37mSuccess[0m
    Verification: [1;37mON[0m
     Disposition: [1;31mIncorrect[0m

reference_device: Incorrect
          cuBLAS: Not run
           cuDNN: Not run

       Arguments: --gemm_kind=universal --m=8192 --n=8192 --k=28672 --A=f16:column --B=f16:row --C=f16:column --D=f16:column  \
                  --alpha=1 --beta=0 --split_k_mode=serial --split_k_slices=1 --batch_count=1 --raster_order=heuristic  \
                  --op_class=tensorop --accum=f16 --cta_m=256 --cta_n=128 --cta_k=32 --cluster_m=1 --cluster_n=1 --cluster_k=1  \
                  --stages=2 --warps_m=4 --warps_n=2 --warps_k=1 --inst_m=16 --inst_n=8 --inst_k=8 --min_cc=75 --max_cc=1024  \
                 

           Bytes: 1073741824  bytes
           FLOPs: 3848424914944  flops
           FLOPs/Byte: 3584

         Runtime: 23.2343  ms
          Memory: 43.0399 GiB/s

            Math: 165636 GFLOP/s



=============================
  Problem ID: 1

        Provider: [1;37mCUTLASS[0m
   OperationKind: [1;37mgemm[0m
       Operation: cutlass_tensorop_h1688gemm_256x128_32x2_nt_align2

          Status: [1;37mSuccess[0m
    Verification: [1;37mON[0m
     Disposition: [1;31mIncorrect[0m

reference_device: Incorrect
          cuBLAS: Not run
           cuDNN: Not run

       Arguments: --gemm_kind=universal --m=8192 --n=8192 --k=28672 --A=f16:column --B=f16:row --C=f16:column --D=f16:column  \
                  --alpha=1 --beta=0 --split_k_mode=serial --split_k_slices=1 --batch_count=1 --raster_order=heuristic  \
                  --op_class=tensorop --accum=f16 --cta_m=256 --cta_n=128 --cta_k=32 --cluster_m=1 --cluster_n=1 --cluster_k=1  \
                  --stages=2 --warps_m=4 --warps_n=2 --warps_k=1 --inst_m=16 --inst_n=8 --inst_k=8 --min_cc=75 --max_cc=1024  \
                 

           Bytes: 1073741824  bytes
           FLOPs: 3848424914944  flops
           FLOPs/Byte: 3584

         Runtime: 32.8295  ms
          Memory: 30.4604 GiB/s

            Math: 117224 GFLOP/s



=============================
  Problem ID: 1

        Provider: [1;37mCUTLASS[0m
   OperationKind: [1;37mgemm[0m
       Operation: cutlass_tensorop_h1688gemm_256x128_32x2_nt_align1

          Status: [1;37mSuccess[0m
    Verification: [1;37mON[0m
     Disposition: [1;31mIncorrect[0m

reference_device: Incorrect
          cuBLAS: Not run
           cuDNN: Not run

       Arguments: --gemm_kind=universal --m=8192 --n=8192 --k=28672 --A=f16:column --B=f16:row --C=f16:column --D=f16:column  \
                  --alpha=1 --beta=0 --split_k_mode=serial --split_k_slices=1 --batch_count=1 --raster_order=heuristic  \
                  --op_class=tensorop --accum=f16 --cta_m=256 --cta_n=128 --cta_k=32 --cluster_m=1 --cluster_n=1 --cluster_k=1  \
                  --stages=2 --warps_m=4 --warps_n=2 --warps_k=1 --inst_m=16 --inst_n=8 --inst_k=8 --min_cc=75 --max_cc=1024  \
                 

           Bytes: 1073741824  bytes
           FLOPs: 3848424914944  flops
           FLOPs/Byte: 3584

         Runtime: 36.988  ms
          Memory: 27.0358 GiB/s

            Math: 104045 GFLOP/s



=============================
  Problem ID: 1

        Provider: [1;37mCUTLASS[0m
   OperationKind: [1;37mgemm[0m
       Operation: cutlass_tensorop_h1688gemm_128x256_32x2_nt_align8

          Status: [1;37mSuccess[0m
    Verification: [1;37mON[0m
     Disposition: [1;31mIncorrect[0m

reference_device: Incorrect
          cuBLAS: Not run
           cuDNN: Not run

       Arguments: --gemm_kind=universal --m=8192 --n=8192 --k=28672 --A=f16:column --B=f16:row --C=f16:column --D=f16:column  \
                  --alpha=1 --beta=0 --split_k_mode=serial --split_k_slices=1 --batch_count=1 --raster_order=heuristic  \
                  --op_class=tensorop --accum=f16 --cta_m=128 --cta_n=256 --cta_k=32 --cluster_m=1 --cluster_n=1 --cluster_k=1  \
                  --stages=2 --warps_m=2 --warps_n=4 --warps_k=1 --inst_m=16 --inst_n=8 --inst_k=8 --min_cc=75 --max_cc=1024  \
                 

           Bytes: 1073741824  bytes
           FLOPs: 3848424914944  flops
           FLOPs/Byte: 3584

         Runtime: 20.68  ms
          Memory: 48.3559 GiB/s

            Math: 186094 GFLOP/s



=============================
  Problem ID: 1

        Provider: [1;37mCUTLASS[0m
   OperationKind: [1;37mgemm[0m
       Operation: cutlass_tensorop_h1688gemm_128x256_32x2_nt_align4

          Status: [1;37mSuccess[0m
    Verification: [1;37mON[0m
     Disposition: [1;31mIncorrect[0m

reference_device: Incorrect
          cuBLAS: Not run
           cuDNN: Not run

       Arguments: --gemm_kind=universal --m=8192 --n=8192 --k=28672 --A=f16:column --B=f16:row --C=f16:column --D=f16:column  \
                  --alpha=1 --beta=0 --split_k_mode=serial --split_k_slices=1 --batch_count=1 --raster_order=heuristic  \
                  --op_class=tensorop --accum=f16 --cta_m=128 --cta_n=256 --cta_k=32 --cluster_m=1 --cluster_n=1 --cluster_k=1  \
                  --stages=2 --warps_m=2 --warps_n=4 --warps_k=1 --inst_m=16 --inst_n=8 --inst_k=8 --min_cc=75 --max_cc=1024  \
                 

           Bytes: 1073741824  bytes
           FLOPs: 3848424914944  flops
           FLOPs/Byte: 3584

         Runtime: 24.4939  ms
          Memory: 40.8265 GiB/s

            Math: 157118 GFLOP/s



=============================
  Problem ID: 1

        Provider: [1;37mCUTLASS[0m
   OperationKind: [1;37mgemm[0m
       Operation: cutlass_tensorop_h1688gemm_128x256_32x2_nt_align2

          Status: [1;37mSuccess[0m
    Verification: [1;37mON[0m
     Disposition: [1;31mIncorrect[0m

reference_device: Incorrect
          cuBLAS: Not run
           cuDNN: Not run

       Arguments: --gemm_kind=universal --m=8192 --n=8192 --k=28672 --A=f16:column --B=f16:row --C=f16:column --D=f16:column  \
                  --alpha=1 --beta=0 --split_k_mode=serial --split_k_slices=1 --batch_count=1 --raster_order=heuristic  \
                  --op_class=tensorop --accum=f16 --cta_m=128 --cta_n=256 --cta_k=32 --cluster_m=1 --cluster_n=1 --cluster_k=1  \
                  --stages=2 --warps_m=2 --warps_n=4 --warps_k=1 --inst_m=16 --inst_n=8 --inst_k=8 --min_cc=75 --max_cc=1024  \
                 

           Bytes: 1073741824  bytes
           FLOPs: 3848424914944  flops
           FLOPs/Byte: 3584

         Runtime: 32.4037  ms
          Memory: 30.8607 GiB/s

            Math: 118765 GFLOP/s



=============================
  Problem ID: 1

        Provider: [1;37mCUTLASS[0m
   OperationKind: [1;37mgemm[0m
       Operation: cutlass_tensorop_h1688gemm_128x256_32x2_nt_align1

          Status: [1;37mSuccess[0m
    Verification: [1;37mON[0m
     Disposition: [1;31mIncorrect[0m

reference_device: Incorrect
          cuBLAS: Not run
           cuDNN: Not run

       Arguments: --gemm_kind=universal --m=8192 --n=8192 --k=28672 --A=f16:column --B=f16:row --C=f16:column --D=f16:column  \
                  --alpha=1 --beta=0 --split_k_mode=serial --split_k_slices=1 --batch_count=1 --raster_order=heuristic  \
                  --op_class=tensorop --accum=f16 --cta_m=128 --cta_n=256 --cta_k=32 --cluster_m=1 --cluster_n=1 --cluster_k=1  \
                  --stages=2 --warps_m=2 --warps_n=4 --warps_k=1 --inst_m=16 --inst_n=8 --inst_k=8 --min_cc=75 --max_cc=1024  \
                 

           Bytes: 1073741824  bytes
           FLOPs: 3848424914944  flops
           FLOPs/Byte: 3584

         Runtime: 36.5547  ms
          Memory: 27.3563 GiB/s

            Math: 105279 GFLOP/s



=============================
  Problem ID: 1

        Provider: [1;37mCUTLASS[0m
   OperationKind: [1;37mgemm[0m
       Operation: cutlass_tensorop_h1688gemm_128x128_32x2_nt_align8

          Status: [1;37mSuccess[0m
    Verification: [1;37mON[0m
     Disposition: [1;31mIncorrect[0m

reference_device: Incorrect
          cuBLAS: Not run
           cuDNN: Not run

       Arguments: --gemm_kind=universal --m=8192 --n=8192 --k=28672 --A=f16:column --B=f16:row --C=f16:column --D=f16:column  \
                  --alpha=1 --beta=0 --split_k_mode=serial --split_k_slices=1 --batch_count=1 --raster_order=heuristic  \
                  --op_class=tensorop --accum=f16 --cta_m=128 --cta_n=128 --cta_k=32 --cluster_m=1 --cluster_n=1 --cluster_k=1  \
                  --stages=2 --warps_m=2 --warps_n=2 --warps_k=1 --inst_m=16 --inst_n=8 --inst_k=8 --min_cc=75 --max_cc=1024  \
                 

           Bytes: 1073741824  bytes
           FLOPs: 3848424914944  flops
           FLOPs/Byte: 3584

         Runtime: 19.1085  ms
          Memory: 52.3329 GiB/s

            Math: 201399 GFLOP/s



=============================
  Problem ID: 1

        Provider: [1;37mCUTLASS[0m
   OperationKind: [1;37mgemm[0m
       Operation: cutlass_tensorop_h1688gemm_128x128_32x2_nt_align4

          Status: [1;37mSuccess[0m
    Verification: [1;37mON[0m
     Disposition: [1;31mIncorrect[0m

reference_device: Incorrect
          cuBLAS: Not run
           cuDNN: Not run

       Arguments: --gemm_kind=universal --m=8192 --n=8192 --k=28672 --A=f16:column --B=f16:row --C=f16:column --D=f16:column  \
                  --alpha=1 --beta=0 --split_k_mode=serial --split_k_slices=1 --batch_count=1 --raster_order=heuristic  \
                  --op_class=tensorop --accum=f16 --cta_m=128 --cta_n=128 --cta_k=32 --cluster_m=1 --cluster_n=1 --cluster_k=1  \
                  --stages=2 --warps_m=2 --warps_n=2 --warps_k=1 --inst_m=16 --inst_n=8 --inst_k=8 --min_cc=75 --max_cc=1024  \
                 

           Bytes: 1073741824  bytes
           FLOPs: 3848424914944  flops
           FLOPs/Byte: 3584

         Runtime: 21.2509  ms
          Memory: 47.0569 GiB/s

            Math: 181095 GFLOP/s



=============================
  Problem ID: 1

        Provider: [1;37mCUTLASS[0m
   OperationKind: [1;37mgemm[0m
       Operation: cutlass_tensorop_h1688gemm_128x128_32x2_nt_align2

          Status: [1;37mSuccess[0m
    Verification: [1;37mON[0m
     Disposition: [1;31mIncorrect[0m

reference_device: Incorrect
          cuBLAS: Not run
           cuDNN: Not run

       Arguments: --gemm_kind=universal --m=8192 --n=8192 --k=28672 --A=f16:column --B=f16:row --C=f16:column --D=f16:column  \
                  --alpha=1 --beta=0 --split_k_mode=serial --split_k_slices=1 --batch_count=1 --raster_order=heuristic  \
                  --op_class=tensorop --accum=f16 --cta_m=128 --cta_n=128 --cta_k=32 --cluster_m=1 --cluster_n=1 --cluster_k=1  \
                  --stages=2 --warps_m=2 --warps_n=2 --warps_k=1 --inst_m=16 --inst_n=8 --inst_k=8 --min_cc=75 --max_cc=1024  \
                 

           Bytes: 1073741824  bytes
           FLOPs: 3848424914944  flops
           FLOPs/Byte: 3584

         Runtime: 25.1495  ms
          Memory: 39.7622 GiB/s

            Math: 153022 GFLOP/s



=============================
  Problem ID: 1

        Provider: [1;37mCUTLASS[0m
   OperationKind: [1;37mgemm[0m
       Operation: cutlass_tensorop_h1688gemm_128x128_32x2_nt_align1

          Status: [1;37mSuccess[0m
    Verification: [1;37mON[0m
     Disposition: [1;31mIncorrect[0m

reference_device: Incorrect
          cuBLAS: Not run
           cuDNN: Not run

       Arguments: --gemm_kind=universal --m=8192 --n=8192 --k=28672 --A=f16:column --B=f16:row --C=f16:column --D=f16:column  \
                  --alpha=1 --beta=0 --split_k_mode=serial --split_k_slices=1 --batch_count=1 --raster_order=heuristic  \
                  --op_class=tensorop --accum=f16 --cta_m=128 --cta_n=128 --cta_k=32 --cluster_m=1 --cluster_n=1 --cluster_k=1  \
                  --stages=2 --warps_m=2 --warps_n=2 --warps_k=1 --inst_m=16 --inst_n=8 --inst_k=8 --min_cc=75 --max_cc=1024  \
                 

           Bytes: 1073741824  bytes
           FLOPs: 3848424914944  flops
           FLOPs/Byte: 3584

         Runtime: 37.7529  ms
          Memory: 26.488 GiB/s

            Math: 101937 GFLOP/s



=============================
  Problem ID: 1

        Provider: [1;37mCUTLASS[0m
   OperationKind: [1;37mgemm[0m
       Operation: cutlass_tensorop_h1688gemm_64x256_32x2_nt_align8

          Status: [1;37mSuccess[0m
    Verification: [1;37mON[0m
     Disposition: [1;31mIncorrect[0m

reference_device: Incorrect
          cuBLAS: Not run
           cuDNN: Not run

       Arguments: --gemm_kind=universal --m=8192 --n=8192 --k=28672 --A=f16:column --B=f16:row --C=f16:column --D=f16:column  \
                  --alpha=1 --beta=0 --split_k_mode=serial --split_k_slices=1 --batch_count=1 --raster_order=heuristic  \
                  --op_class=tensorop --accum=f16 --cta_m=64 --cta_n=256 --cta_k=32 --cluster_m=1 --cluster_n=1 --cluster_k=1  \
                  --stages=2 --warps_m=1 --warps_n=4 --warps_k=1 --inst_m=16 --inst_n=8 --inst_k=8 --min_cc=75 --max_cc=1024  \
                 

           Bytes: 1073741824  bytes
           FLOPs: 3848424914944  flops
           FLOPs/Byte: 3584

         Runtime: 21.4264  ms
          Memory: 46.6714 GiB/s

            Math: 179612 GFLOP/s



=============================
  Problem ID: 1

        Provider: [1;37mCUTLASS[0m
   OperationKind: [1;37mgemm[0m
       Operation: cutlass_tensorop_h1688gemm_64x256_32x2_nt_align4

          Status: [1;37mSuccess[0m
    Verification: [1;37mON[0m
     Disposition: [1;31mIncorrect[0m

reference_device: Incorrect
          cuBLAS: Not run
           cuDNN: Not run

       Arguments: --gemm_kind=universal --m=8192 --n=8192 --k=28672 --A=f16:column --B=f16:row --C=f16:column --D=f16:column  \
                  --alpha=1 --beta=0 --split_k_mode=serial --split_k_slices=1 --batch_count=1 --raster_order=heuristic  \
                  --op_class=tensorop --accum=f16 --cta_m=64 --cta_n=256 --cta_k=32 --cluster_m=1 --cluster_n=1 --cluster_k=1  \
                  --stages=2 --warps_m=1 --warps_n=4 --warps_k=1 --inst_m=16 --inst_n=8 --inst_k=8 --min_cc=75 --max_cc=1024  \
                 

           Bytes: 1073741824  bytes
           FLOPs: 3848424914944  flops
           FLOPs/Byte: 3584

         Runtime: 23.6211  ms
          Memory: 42.335 GiB/s

            Math: 162923 GFLOP/s



=============================
  Problem ID: 1

        Provider: [1;37mCUTLASS[0m
   OperationKind: [1;37mgemm[0m
       Operation: cutlass_tensorop_h1688gemm_64x256_32x2_nt_align2

          Status: [1;37mSuccess[0m
    Verification: [1;37mON[0m
     Disposition: [1;31mIncorrect[0m

reference_device: Incorrect
          cuBLAS: Not run
           cuDNN: Not run

       Arguments: --gemm_kind=universal --m=8192 --n=8192 --k=28672 --A=f16:column --B=f16:row --C=f16:column --D=f16:column  \
                  --alpha=1 --beta=0 --split_k_mode=serial --split_k_slices=1 --batch_count=1 --raster_order=heuristic  \
                  --op_class=tensorop --accum=f16 --cta_m=64 --cta_n=256 --cta_k=32 --cluster_m=1 --cluster_n=1 --cluster_k=1  \
                  --stages=2 --warps_m=1 --warps_n=4 --warps_k=1 --inst_m=16 --inst_n=8 --inst_k=8 --min_cc=75 --max_cc=1024  \
                 

           Bytes: 1073741824  bytes
           FLOPs: 3848424914944  flops
           FLOPs/Byte: 3584

         Runtime: 28.5894  ms
          Memory: 34.978 GiB/s

            Math: 134610 GFLOP/s



=============================
  Problem ID: 1

        Provider: [1;37mCUTLASS[0m
   OperationKind: [1;37mgemm[0m
       Operation: cutlass_tensorop_h1688gemm_64x256_32x2_nt_align1

          Status: [1;37mSuccess[0m
    Verification: [1;37mON[0m
     Disposition: [1;31mIncorrect[0m

reference_device: Incorrect
          cuBLAS: Not run
           cuDNN: Not run

       Arguments: --gemm_kind=universal --m=8192 --n=8192 --k=28672 --A=f16:column --B=f16:row --C=f16:column --D=f16:column  \
                  --alpha=1 --beta=0 --split_k_mode=serial --split_k_slices=1 --batch_count=1 --raster_order=heuristic  \
                  --op_class=tensorop --accum=f16 --cta_m=64 --cta_n=256 --cta_k=32 --cluster_m=1 --cluster_n=1 --cluster_k=1  \
                  --stages=2 --warps_m=1 --warps_n=4 --warps_k=1 --inst_m=16 --inst_n=8 --inst_k=8 --min_cc=75 --max_cc=1024  \
                 

           Bytes: 1073741824  bytes
           FLOPs: 3848424914944  flops
           FLOPs/Byte: 3584

         Runtime: 45.572  ms
          Memory: 21.9433 GiB/s

            Math: 84447.1 GFLOP/s



=============================
  Problem ID: 1

        Provider: [1;37mCUTLASS[0m
   OperationKind: [1;37mgemm[0m
       Operation: cutlass_tensorop_h1688gemm_256x64_32x2_nt_align8

          Status: [1;37mSuccess[0m
    Verification: [1;37mON[0m
     Disposition: [1;31mIncorrect[0m

reference_device: Incorrect
          cuBLAS: Not run
           cuDNN: Not run

       Arguments: --gemm_kind=universal --m=8192 --n=8192 --k=28672 --A=f16:column --B=f16:row --C=f16:column --D=f16:column  \
                  --alpha=1 --beta=0 --split_k_mode=serial --split_k_slices=1 --batch_count=1 --raster_order=heuristic  \
                  --op_class=tensorop --accum=f16 --cta_m=256 --cta_n=64 --cta_k=32 --cluster_m=1 --cluster_n=1 --cluster_k=1  \
                  --stages=2 --warps_m=4 --warps_n=1 --warps_k=1 --inst_m=16 --inst_n=8 --inst_k=8 --min_cc=75 --max_cc=1024  \
                 

           Bytes: 1073741824  bytes
           FLOPs: 3848424914944  flops
           FLOPs/Byte: 3584

         Runtime: 23.5887  ms
          Memory: 42.3933 GiB/s

            Math: 163147 GFLOP/s



=============================
  Problem ID: 1

        Provider: [1;37mCUTLASS[0m
   OperationKind: [1;37mgemm[0m
       Operation: cutlass_tensorop_h1688gemm_256x64_32x2_nt_align4

          Status: [1;37mSuccess[0m
    Verification: [1;37mON[0m
     Disposition: [1;31mIncorrect[0m

reference_device: Incorrect
          cuBLAS: Not run
           cuDNN: Not run

       Arguments: --gemm_kind=universal --m=8192 --n=8192 --k=28672 --A=f16:column --B=f16:row --C=f16:column --D=f16:column  \
                  --alpha=1 --beta=0 --split_k_mode=serial --split_k_slices=1 --batch_count=1 --raster_order=heuristic  \
                  --op_class=tensorop --accum=f16 --cta_m=256 --cta_n=64 --cta_k=32 --cluster_m=1 --cluster_n=1 --cluster_k=1  \
                  --stages=2 --warps_m=4 --warps_n=1 --warps_k=1 --inst_m=16 --inst_n=8 --inst_k=8 --min_cc=75 --max_cc=1024  \
                 

           Bytes: 1073741824  bytes
           FLOPs: 3848424914944  flops
           FLOPs/Byte: 3584

         Runtime: 24.4233  ms
          Memory: 40.9445 GiB/s

            Math: 157572 GFLOP/s



=============================
  Problem ID: 1

        Provider: [1;37mCUTLASS[0m
   OperationKind: [1;37mgemm[0m
       Operation: cutlass_tensorop_h1688gemm_256x64_32x2_nt_align2

          Status: [1;37mSuccess[0m
    Verification: [1;37mON[0m
     Disposition: [1;31mIncorrect[0m

reference_device: Incorrect
          cuBLAS: Not run
           cuDNN: Not run

       Arguments: --gemm_kind=universal --m=8192 --n=8192 --k=28672 --A=f16:column --B=f16:row --C=f16:column --D=f16:column  \
                  --alpha=1 --beta=0 --split_k_mode=serial --split_k_slices=1 --batch_count=1 --raster_order=heuristic  \
                  --op_class=tensorop --accum=f16 --cta_m=256 --cta_n=64 --cta_k=32 --cluster_m=1 --cluster_n=1 --cluster_k=1  \
                  --stages=2 --warps_m=4 --warps_n=1 --warps_k=1 --inst_m=16 --inst_n=8 --inst_k=8 --min_cc=75 --max_cc=1024  \
                 

           Bytes: 1073741824  bytes
           FLOPs: 3848424914944  flops
           FLOPs/Byte: 3584

         Runtime: 29.0541  ms
          Memory: 34.4186 GiB/s

            Math: 132457 GFLOP/s



=============================
  Problem ID: 1

        Provider: [1;37mCUTLASS[0m
   OperationKind: [1;37mgemm[0m
       Operation: cutlass_tensorop_h1688gemm_256x64_32x2_nt_align1

          Status: [1;37mSuccess[0m
    Verification: [1;37mON[0m
     Disposition: [1;31mIncorrect[0m

reference_device: Incorrect
          cuBLAS: Not run
           cuDNN: Not run

       Arguments: --gemm_kind=universal --m=8192 --n=8192 --k=28672 --A=f16:column --B=f16:row --C=f16:column --D=f16:column  \
                  --alpha=1 --beta=0 --split_k_mode=serial --split_k_slices=1 --batch_count=1 --raster_order=heuristic  \
                  --op_class=tensorop --accum=f16 --cta_m=256 --cta_n=64 --cta_k=32 --cluster_m=1 --cluster_n=1 --cluster_k=1  \
                  --stages=2 --warps_m=4 --warps_n=1 --warps_k=1 --inst_m=16 --inst_n=8 --inst_k=8 --min_cc=75 --max_cc=1024  \
                 

           Bytes: 1073741824  bytes
           FLOPs: 3848424914944  flops
           FLOPs/Byte: 3584

         Runtime: 45.9893  ms
          Memory: 21.7442 GiB/s

            Math: 83680.9 GFLOP/s



=============================
  Problem ID: 1

        Provider: [1;37mCUTLASS[0m
   OperationKind: [1;37mgemm[0m
       Operation: cutlass_tensorop_h1688gemm_64x128_32x2_nt_align8

          Status: [1;37mSuccess[0m
    Verification: [1;37mON[0m
     Disposition: [1;31mIncorrect[0m

reference_device: Incorrect
          cuBLAS: Not run
           cuDNN: Not run

       Arguments: --gemm_kind=universal --m=8192 --n=8192 --k=28672 --A=f16:column --B=f16:row --C=f16:column --D=f16:column  \
                  --alpha=1 --beta=0 --split_k_mode=serial --split_k_slices=1 --batch_count=1 --raster_order=heuristic  \
                  --op_class=tensorop --accum=f16 --cta_m=64 --cta_n=128 --cta_k=32 --cluster_m=1 --cluster_n=1 --cluster_k=1  \
                  --stages=2 --warps_m=2 --warps_n=2 --warps_k=1 --inst_m=16 --inst_n=8 --inst_k=8 --min_cc=75 --max_cc=1024  \
                 

           Bytes: 1073741824  bytes
           FLOPs: 3848424914944  flops
           FLOPs/Byte: 3584

         Runtime: 26.52  ms
          Memory: 37.7074 GiB/s

            Math: 145114 GFLOP/s



=============================
  Problem ID: 1

        Provider: [1;37mCUTLASS[0m
   OperationKind: [1;37mgemm[0m
       Operation: cutlass_tensorop_h1688gemm_64x128_32x2_nt_align4

          Status: [1;37mSuccess[0m
    Verification: [1;37mON[0m
     Disposition: [1;31mIncorrect[0m

reference_device: Incorrect
          cuBLAS: Not run
           cuDNN: Not run

       Arguments: --gemm_kind=universal --m=8192 --n=8192 --k=28672 --A=f16:column --B=f16:row --C=f16:column --D=f16:column  \
                  --alpha=1 --beta=0 --split_k_mode=serial --split_k_slices=1 --batch_count=1 --raster_order=heuristic  \
                  --op_class=tensorop --accum=f16 --cta_m=64 --cta_n=128 --cta_k=32 --cluster_m=1 --cluster_n=1 --cluster_k=1  \
